["O-H", "W", "2020/12/19", "#OxloveTheThird42", "A O-H @W Marxist in the streets, Czarist in the sheets", "Oxlove 3: electric troogaloo"]
["EM", "S", "2020/12/19", "#OxloveTheThird41", "EM @St A I know that you\u2019re too scared to talk to AH @St A, but I believe in u x", "Oxlove 3: electric troogaloo"]
["ZS", "J", "2020/12/19", "#OxloveTheThird40", "ZS@J trinity is gonna be ur term. Keep on flourishing xxxxxx", "Oxlove 3: electric troogaloo"]
["CG", "B", "2020/12/19", "#OxloveTheThird39", "CG @ B can we grab a drink next term?", "Oxlove 3: electric troogaloo"]
["N/A", "N/A", "2020/12/19", "#OxloveTheThird38", "FS @ wad : miss you, love you, sorry for the crisps !!!!!!!!! aaaaaaa!!!", "Oxlove 3: electric troogaloo"]
["N/A", "N/A", "2020/12/19", "#OxloveTheThird37", "big oxlove to SD @ wadham : you're amazing and i love you! enjoy home, see you soon baby xo", "Oxlove 3: electric troogaloo"]
["JF", "J", "2020/12/18", "#OxloveTheThird36", "oxlove to JF @ J - you're sweet and adorable, thank you for listening to me ramble about gender", "Oxlove 3: electric troogaloo"]
["N/A", "N/A", "2020/12/18", "#OxloveTheThird35", "oxlove to MR @ wadham ,, everyone's favourite top shagger oioi", "Oxlove 3: electric troogaloo"]
["JP", "U", "2020/12/18", "#OxloveTheThird22", "JP@U we've been friends for ages but barely saw eachother in michaelmas, need to meet up more next term ", "Oxlove 3: electric troogaloo"]
["N/A", "N/A", "2020/12/18", "#OxloveTheThird34", "Oxlove to RD @ wadham - you\u2019re brilliant", "Oxlove 3: electric troogaloo"]
["N/A", "N/A", "2020/12/18", "#OxloveTheThird33", "Oxlove to the people who promise they're going to text over vac and actually do", "Oxlove 3: electric troogaloo"]
["JF", "RHCP", "2020/12/18", "#OxloveTheThird32", "Oxlove to JF @ RHCP. Can you pluck my (heart)strings and play with my axe?", "Oxlove 3: electric troogaloo"]
["CM", "Q", "2020/12/18", "#OxloveTheThird30", "Oxlove to CM @Q your lectures may be boring, but a man in a gown ticks all my boxes", "Oxlove 3: electric troogaloo"]
["DB", "P", "2020/12/18", "#OxloveTheThird28", "Oxlove to DB @P for being an absolute stunner and a total babe to talk to", "Oxlove 3: electric troogaloo"]
["N/A", "N/A", "2020/12/18", "#OxloveTheThird26", "Oxlove to We are Young, Stacy\u2019s Mom and Earthquake for carrying every secondary school disco I went to. They all still slap today", "Oxlove 3: electric troogaloo"]
["N/A", "N/A", "2020/12/18", "#OxloveTheThird24", "LW@chch I'd love u even if u stabbed me u absolute beauty", "Oxlove 3: electric troogaloo"]
["MA", "SPC", "2020/12/17", "#OxloveTheThird23", "MA @ SPC may your moustache bring u happiness and prosperity", "Oxlove 3: electric troogaloo"]
["AT", "B", "2020/12/17", "#OxloveTheThird20", "AT @B I saw you playing trumpet last year... I was never the same afterwards x", "Oxlove 3: electric troogaloo"]
["RR", "J", "2020/12/17", "#OxloveTheThird19", "RR @J You\u2019re a really cool guy with even cooler guitar skills. Have a great day!", "Oxlove 3: electric troogaloo"]
["AH", "S", "2020/12/17", "#OxloveTheThird18", "AH @St AWish I could speak to u but you\u2019re so cool...", "Oxlove 3: electric troogaloo"]
["BG", "JI", "2020/12/17", "#OxloveTheThird17", "BG @JI saw you playing college rugby... Wanna get coffee    4 commentsLikeCommentShareCommentsView 1 more commentOldestHarriet WallBen Greenbury think someone spotted the wrong player... ??", "Oxlove 3: electric troogaloo"]
["N/A", "N/A", "2020/12/17", "#OxloveTheThird15", "Oxlove to my tutor for being almost as lazy and twice as disorganised as me this term. You\u2019ve fucked my degree but I still love u x", "Oxlove 3: electric troogaloo"]
["FG", "M", "2020/12/17", "#OxloveTheThird14", "Oxlove to FG @M. First FG Oxlove of the new page. BTW you\u2019re fit", "Oxlove 3: electric troogaloo"]
["JK", "E", "2020/12/17", "#OxloveTheThird13", "JK @E such a lovely singing voice", "Oxlove 3: electric troogaloo"]
["N/A", "N/A", "2020/12/17", "#OxloveTheThird12", "Oxlove to Hassan's, you never realise how much you miss something until it's gone...", "Oxlove 3: electric troogaloo"]
["N/A", "N/A", "2020/12/17", "#OxloveTheThird11", "RD + RT get it onnn", "Oxlove 3: electric troogaloo"]
["OH", "LMH", "2020/12/17", "#OxloveTheThird10", "OH @ LMH Wear me like u wear that bucket hat x", "Oxlove 3: electric troogaloo"]
["JC", "SPC", "2020/12/17", "#OxloveTheThird9", "JC @SPC keep being an abolute icon xx", "Oxlove 3: electric troogaloo"]
["N/A", "N/A", "2020/12/14", "#OxloveTheThird8", "if i say i love you, i mean it. i don't say that to everyonei care about you, i want you to be happy, i will always be there for youjust a lil reminder  ps: miss u tons", "Oxlove 3: electric troogaloo"]
["N/A", "N/A", "2020/12/14", "#OxloveTheThird7", "Oxlove to the Bridge of Sighs, such a nice structure", "Oxlove 3: electric troogaloo"]
["N/A", "N/A", "2020/12/12", "#OxloveTheThird6", "Oxlove to frogs. The real princes all along", "Oxlove 3: electric troogaloo"]
["N/A", "N/A", "2020/12/12", "#OxloveTheThird5", "Oxlove to the people in remote parts of the country/world - you\u2019re not alone in feeling alone x", "Oxlove 3: electric troogaloo"]
["JT", "O", "2020/12/12", "#OxloveTheThird3", "JT@O Even if you never got a place at Oriel, you've still got a special place in our heart. Happy birthday ", "Oxlove 3: electric troogaloo"]
["N/A", "N/A", "2020/12/11", "#OxloveTheThird1", "RIP old Oxlove, you were beautiful while you lasted.", "Oxlove 3: electric troogaloo"]
["N/A", "N/A", "2020/11/15", "#OxfessThree13271", "@admin comment: please consult a doctor before trying ANY advice within this postTACTICAL ALL-NIGHTERS II: THIS TIME IT'S CLINICAL\u2026 See more", "Oxfess 3"]
["N/A", "N/A", "2020/11/15", "#OxfessThree13270", "Ah fuck, I just want a big hug. For no particular reason.Is that too much to ask?", "Oxfess 3"]
["N/A", "N/A", "2020/11/15", "#OxfessThree13268", "hey I've been seeing posts of the genre so just wanted to say: if anyone (particularly freshers who might not know much about this) is concerned about covid/family/safety/travel and might want to stay at home next term, please know that the uni is being quite lax with residency exemption applications! interpret those permissible reasons ~flexibly~ and prioritize your own physical&mental health over this uni and government's failed, insensitive response!!", "Oxfess 3"]
["N/A", "N/A", "2020/11/15", "#OxfessThree13262", "I\u2019m a 2nd year, I feel so extremely lonely, like every friend I make doesn\u2019t really want to be friends and just wants to speak to me when it\u2019s convenient- typically when they want something. I just don\u2019t get why I can\u2019t have the same uni experience as everyone else. It\u2019s just so frustrating!!", "Oxfess 3"]
["N/A", "N/A", "2020/11/15", "#OxfessThree13261", "@admin comment: OP, if you feel it would help, the counselling service can be contacted at https://www.ox.ac.uk/students/welfare/counselling. Futher links to mental health resources can be found in the pinned postAnyone else feel like they don't really belong at Oxford or not really know what they're doing here? I don't mean in the imposter syndrome sense, but in a more profound way, more existential like?\u2026 See more", "Oxfess 3"]
["N/A", "N/A", "2020/11/15", "#OxfessThree13260", "I hate coriander but at this point the cooks at my college know me and that I never listed it as an allergy, despite eating their daily coriander infusions, and now I don't know if it will be rude to tell them to stop putting that green soapy garbage on literally every meal", "Oxfess 3"]
["N/A", "N/A", "2020/11/15", "#OxfessThree13259", "Thinking of creating a groupchat for people who will have to stay in Oxford this Christmas!I\u2019ve been studying in the UK as an international student for quite a few years, but this is the first time I\u2019m spending the New Year here; and, having received an email from my college saying they won\u2019t be providing vacation residence unless there are exceptional circumstances, I\u2019m worried that this holiday might be super lonely. If you\u2019re interested in joining a grou\u2026 See more", "Oxfess 3"]
["N/A", "N/A", "2020/11/15", "#OxfessThree13258", "closeted fresher, I don't care about sex, I just really want a gf to cuddle and be close with", "Oxfess 3"]
["N/A", "N/A", "2020/11/15", "#OxfessThree13257", "oxhate to those who put everyone else at risk by breaking self-isolation rules. also what's the point of getting everyone to sign covid-19 responsibility agreements if the college isn't enforcing them", "Oxfess 3"]
["N/A", "N/A", "2020/11/15", "#OxfessThree13255", "\"Rebuild the Union\"? Let's just knock it down and call it a day", "Oxfess 3"]
["N/A", "N/A", "2020/11/15", "#OxfessThree13254", "alright guys, making my secret ingredient for the perfect carbonara not so secret:Milk.", "Oxfess 3"]
["N/A", "N/A", "2020/11/15", "#OxfessThree13253", "Err, ' excuses me laydeh?!  \u00b7 See original  \u00b7 Rate this translation", "Oxfess 3"]
["N/A", "N/A", "2020/11/15", "#OxfessThree13252", "Wtf is this \u201cdjungelskog\u201d chat, and can it please find a bin?", "Oxfess 3"]
["N/A", "N/A", "2020/11/15", "#OxfessThree13251", "Oxhate to the law faculty, a compulsory moot is the last thing i needed at this point in the year", "Oxfess 3"]
["N/A", "N/A", "2020/11/15", "#OxfessThree13249", "My flatmate told me she had her tutors write her 'submitted work' for her, to help her get into Oxford. This really annoyed me. Is this a common occurrence here? Is there anything I can do about this?", "Oxfess 3"]
["N/A", "N/A", "2020/11/15", "#OxfessThree13248", "\"Oxford University accepted at least \u00a3726,706 from the Atomic Weapons Establishment\"oh and yet if you reduce tuition fees because everything's online, one of the world's richest universities may go bankrupt?\u2026 See more", "Oxfess 3"]
["N/A", "N/A", "2020/11/15", "#OxfessThree13247", "my god i dressed up all cute and everything to go to tesco and didnt even get one oxlove?? get your shit together oxford you're supposed to fall in love with me at first sight", "Oxfess 3"]
["N/A", "N/A", "2020/11/15", "#OxfessThree13243", "#OxfessThree13145I\u2019ve been feeling exactly the same way. Trying to make contact with the few friends I have but I often get ignored.. if covid wasn\u2019t a thing I would know how to try making new friends but I don\u2019t know how to make things better while still following the rules.", "Oxfess 3"]
["N/A", "N/A", "2020/11/15", "#OxfessThree13241", "do you think if I held my breath long enough I wouldn't have to do this essay", "Oxfess 3"]
["N/A", "N/A", "2020/11/15", "#OxfessThree13240", "on a serious note, when does alcohol consumption become a problem (esp. if alcoholism runs in your immediate family...)", "Oxfess 3"]
["N/A", "N/A", "2020/11/15", "#OxfessThree13239", "didn\u2019t know my type was Thomas Brodie-Sangster as a chess champion wearing a stupid hat but there we go. tag your fit chess champion in stupid hat friends immediately", "Oxfess 3"]
["N/A", "N/A", "2020/11/15", "#OxfessThree13238", "You know your uni's culture is rancid when you remember that there is just a dedicated week when everyone is depressed and it's just accepted as a normal thing", "Oxfess 3"]
["N/A", "N/A", "2020/11/15", "#OxfessThree13236", "#OxfessThree13171americans be like, you\u2019re briddish, pass me my wawdah boddle", "Oxfess 3"]
["N/A", "N/A", "2020/11/15", "#OxfessThree13234", "Is it weird for a 20 year old to be seeing a 16 year old? No shade the person at [college removed].@admin comment: college was removed to make the post less targeted", "Oxfess 3"]
["N/A", "N/A", "2020/11/15", "#OxfessThree13233", "This is how all of you Magdalen (pronounced 'maudlin' for posh reasons) students be.", "Oxfess 3"]
["N/A", "N/A", "2020/11/15", "#OxfessThree13231", "they weren\u2019t lying on open day; Queen\u2019s really is the best college in Oxford", "Oxfess 3"]
["N/A", "N/A", "2020/11/15", "#OxfessThree13229", "Really thought I'd managed to escape 5th week blues. I came so close. But it is inescapable. There is no way out. Resistance is futile. Friday hit like a train.", "Oxfess 3"]
["N/A", "N/A", "2020/11/15", "#OxfessThree13228", "Dear fresher'sAs a postgrad who started my undergrad fresher's term at Ox a ridiculously long time ago, I hope it's not weird for me to write a far too long post here extending my love and sympathy for this absolutely dreadful first experience some of you have had at Oxford (based on your oxfess posts). I'm so so sorry you've had to come up only to spend two terms effectively locked in your rooms being  taught by video calls. If you're feeling lonely or br\u2026 See more", "Oxfess 3"]
["N/A", "N/A", "2020/11/15", "#OxfessThree13227", "As an international student who can\u2019t go home over Christmas ~ I\u2019m going to miss home so so much.", "Oxfess 3"]
["N/A", "N/A", "2020/11/15", "#OxfessThree13224", "Any good lockdown date ideas? I'm thinking of asking someone out but want something a little more special than 'socially distanced walk'", "Oxfess 3"]
["N/A", "N/A", "2020/11/15", "#OxfessThree13223", "Tw: mention of suicide@admin comment: cw depression. OP, if you feel it would help, the counselling service can be contacted at https://www.ox.ac.uk/students/welfare/counselling. Futher links to mental health resources can be found in the pinned post..\u2026 See more", "Oxfess 3"]
["N/A", "N/A", "2020/11/15", "#OxfessThree13219", "NORMALISESHUTTINGTHEFUCKUP", "Oxfess 3"]
["N/A", "N/A", "2020/11/15", "#OxfessThree13218", "Very clear to me now that oxford is full of fake people who claim to be mature and caring", "Oxfess 3"]
["N/A", "N/A", "2020/11/15", "#OxfessThree13217", "being introverted means it's so hard to find friends, how tf can I find people like me at other colleges??", "Oxfess 3"]
["N/A", "N/A", "2020/11/15", "#OxfessThree13216", "#OxfessThree13032Honestly, having been in that situation, it can make you feel like shit. Especially if the relationship was long, you realise maybe you were never truly loved while you felt everything for them. It feels like you were lied to, like you\u2019ve been betrayed but really there\u2019s nobody to blame. You can\u2019t be angry with them (unless they explicitly lied to you) and moreover you\u2019re supposed to be happy for them. That\u2019s easier said than done, and hypo\u2026 See more", "Oxfess 3"]
["N/A", "N/A", "2020/11/15", "#OxfessThree13214", "Just to let everyone know most of us at Regent's Park object to the sincerely wet initiative to improve representations of PPHs in the wider college community. As how a rabbit that roams amidst its local foxholes should do so with a dose of wary respect, Regent's too should know its place in the food chain. Frankly, we should be content that Oxford even allows us to be officially affiliated with the university.", "Oxfess 3"]
["N/A", "N/A", "2020/11/15", "#OxfessThree13210", "Susan Boyle, her song so sweet,Reminds me of the sun;Shining oe\u2019r the world complete,Her song is never done.", "Oxfess 3"]
["N/A", "N/A", "2020/11/15", "#OxfessThree13204", "I really don\u2019t need this fucking pressure. I\u2019m becoming the worst version of myself at this university. Maybe I need the courage to leave.", "Oxfess 3"]
["N/A", "N/A", "2020/11/15", "#OxfessThree13203", "I have friends in college and I\u2019m in a group but it just feels like nobody would care if I wasn\u2019t. I\u2019m a real background character I think if I went away for a week nobody would notice id gone, I guess that\u2019s just life and I don\u2019t know why it bothers me but it does", "Oxfess 3"]
["N/A", "N/A", "2020/11/15", "#OxfessThree13201", "how mentally not coping do i have to be for college to let me suspend?", "Oxfess 3"]
["N/A", "N/A", "2020/11/15", "#OxfessThree13200", "For all the French students out there", "Oxfess 3"]
["N/A", "N/A", "2020/11/15", "#OxfessThree13198", "And the author's name was Greg", "Oxfess 3"]
["N/A", "N/A", "2020/11/15", "#OxfessThree13197", "@Manchester students, Viva la Revolution!!!!!!", "Oxfess 3"]
["N/A", "N/A", "2020/11/15", "#OxfessThree13193", "#OxfessThree13156give tea. they will drink in silence", "Oxfess 3"]
["N/A", "N/A", "2020/11/15", "#OxfessThree13189", "Is starting finals preparation in the winter vac considered early?? Law finals be making me shook...", "Oxfess 3"]
["N/A", "N/A", "2020/11/15", "#OxfessThree13186", "I\u2019m actually sore from how much this term is fucking me", "Oxfess 3"]
["N/A", "N/A", "2020/11/15", "#OxfessThree13184", "Hey anyone filling out the teaching survey please say you want recorded lectures kept it's really important to some of us with disabilities it would mean so much", "Oxfess 3"]
["N/A", "N/A", "2020/11/15", "#OxfessThree13181", "#OxfessThree13149So you would rather people don\u2019t get a choice of who they live with? You think the freshers should be deprived of the choice the people in the years above were given when choosing their rooms? I should hope that households will act as Adults and talk among themselves to discuss if anyone would like to switch rooms to live with people they\u2019ve grown to know more. This isn\u2019t a secondary school residential, this is people\u2019s living situation, an\u2026 See more", "Oxfess 3"]
["N/A", "N/A", "2020/11/15", "#OxfessThree13179", "am I actually struggling with work or am I just a perfectionist always expecting myself to do better because I'm constantly comparing myself with others? my tutor says my work is fine but I'm always stressed because I'm procrastinating or don't know what I'm doing etc, now I don't know if I just need to change my mindset or if I genuinely need help@admin comment: OP, if you feel it would help, the counselling service can be contacted at https://www.ox.ac.u\u2026 See more", "Oxfess 3"]
["N/A", "N/A", "2020/11/15", "#OxfessThree13177", "#OxfessThree13058Update: someone asked whether I was ok and I said \u2018no\u2019. Very therapeutic experience. Oxlove to my lovely friends. Xx", "Oxfess 3"]
["N/A", "N/A", "2020/11/15", "#OxfessThree13176", "#OxfessThree13122 it's called a waste of time, get an aeropress", "Oxfess 3"]
["N/A", "N/A", "2020/11/15", "#OxfessThree13175", "Have a massive crush on a guy, think he likes me back and I do want to get into a relationship with him. But deep down I\u2019m scared that I\u2019ll always be slightly ashamed of him because he\u2019s just not conventionally cool, and I\u2019m not sure whether it\u2019s worth me starting a relationship with him where I\u2019m just going to be embarrassed of him. Am I a horrible person? Or am I just overthinking it all.", "Oxfess 3"]
["N/A", "N/A", "2020/11/14", "#OxfessThree13174", "God I hate myself, why am I always hungry goddammit aghhhh", "Oxfess 3"]
["N/A", "N/A", "2020/11/14", "#OxfessThree13173", "#OxfessThree13149 as a third year you have no idea what you\u2019re talking about. we freshers have not had the chance to socialise you have, pretty much nobody can make friends outside of their household, and for freshers feeling lonely staying in that household where they have no friends is a death sentence. much better to move and get the chance to meet knew people for once!", "Oxfess 3"]
["N/A", "N/A", "2020/11/14", "#OxfessThree13172", "5th week AND Friday 13th?? someone's taking the michael a bit I think", "Oxfess 3"]
["N/A", "N/A", "2020/11/14", "#OxfessThree13171", "british \"people\" be like: im bri ish, pass me mah wah er boh oh", "Oxfess 3"]
["N/A", "N/A", "2020/11/14", "#OxfessThree13170", "If only dms me late at night does he just want another bj", "Oxfess 3"]
["N/A", "N/A", "2020/11/14", "#OxfessThree13169", "Why do random oxford postgrad students mass send out friend requests I DON\u2019T KNOW YOU", "Oxfess 3"]
["N/A", "N/A", "2020/11/14", "#OxfessThree13168", "The new email system is TRASH I loved never having to sign in", "Oxfess 3"]
["N/A", "N/A", "2020/11/13", "#OxfessThree13167", "oxhate to ox for ignoring the welfare of students on their year abroad xx", "Oxfess 3"]
["N/A", "N/A", "2020/11/13", "#OxfessThree13166", "Weird question but does anyone know any tutors/professors that write songs or produce music?", "Oxfess 3"]
["N/A", "N/A", "2020/11/13", "#OxfessThree13165", "If, like me, you sometimes find yourself measuring how good your day was based on how productive you were, take a step back for a sec. Sure, it's awesome to get through a pile of reading or essay writing or admin because we all know that shit is hard even without any of the other stuff that's going on right now. Be proud of being able to do that. But, on the flip side, not being able to do that is also okay. You can find other, maybe smaller things in your d\u2026 See more", "Oxfess 3"]
["N/A", "N/A", "2020/11/13", "#OxfessThree13164", "Poll:How many times have you fallen asleep in online tutorials? I am unconvinced that I am the only person to have achieved this.\u2026 See more", "Oxfess 3"]
["N/A", "N/A", "2020/11/13", "#OxfessThree13163", "Call me a narcissist but I reply* to my own oxfessesCan I help it if I'm the funniest person here? Keeping the bants going since 2018\u2026 See more", "Oxfess 3"]
["N/A", "N/A", "2020/11/13", "#OxfessThree13162", "Not to be cocky, but I write like Honor\u00e9 de Balzac...\u2026 See more", "Oxfess 3"]
["N/A", "N/A", "2020/11/13", "#OxfessThree13161", "I finished at Oxford this summer and have started at Cambridge. I miss oxford. I am paying the price for my heresy. Lord forgive me.", "Oxfess 3"]
["N/A", "N/A", "2020/11/13", "#OxfessThree13160", "How do people deal with intrusive anxious thoughts? Like I'm anxious to even ask people if they wanna call and catch up because I feel like I'm annoying them and being a burden on their time (knowing how much of a premium it is at this uni). Then when I finally pluck up the courage to suggest or ask if we can call and don't get a response on the same day, my mind immediately tells me I'm being overly needy and am annoying, hence why the other person isn't re\u2026 See more", "Oxfess 3"]
["N/A", "N/A", "2020/11/13", "#OxfessThree13159", "If you love Chalamet, boy, do I have a gift for you: Jack Dylan Grazer. BTW, Luca Guadagnino definitely has a type lol", "Oxfess 3"]
["N/A", "N/A", "2020/11/13", "#OxfessThree13158", "NORMALISETHEWAVEFUNCTION", "Oxfess 3"]
["N/A", "N/A", "2020/11/13", "#OxfessThree13157", "Could some 4th year computer scientists please shed some light which optional courses got the easiest exam once you\u2019ve done enough revision and got through most past papers? Heard that AI and Databases are good, any others? From an already tired third year trying to get a 2.1 oops", "Oxfess 3"]
["N/A", "N/A", "2020/11/13", "#OxfessThree13156", "do any internationals find some british people a bit too loud? what is a polite way to address that?", "Oxfess 3"]
["N/A", "N/A", "2020/11/13", "#OxfessThree13155", "bruh, I really thought this 5th week blues thing was an exaggeration until about 7pm today when it hit me. I HATE IT HEREEE", "Oxfess 3"]
["N/A", "N/A", "2020/11/13", "#OxfessThree13154", "Getting a covid test tomorrow, does anyone know how long it takes? The anxiety is already driving me insane", "Oxfess 3"]
["N/A", "N/A", "2020/11/13", "#OxfessThree13153", "How are you meant to dry jeans if they can't be tumble-dried? There's not enough space in student rooms to dry a whole load of washing, and they won't dry quickly or well on a clothes horse. I'm sure mine have shrunk because I tumble-dried them.", "Oxfess 3"]
["N/A", "N/A", "2020/11/13", "#OxfessThree13152", "Quick horror Thursday throwback to when I checked into an Airbnb in US and saw blood stains on the ceiling evidently from a ......yes......terrifying experience", "Oxfess 3"]
["N/A", "N/A", "2020/11/13", "#OxfessThree13151", "Oxhate to st Anne\u2019s for buying cheap toilet paper! I\u2019m tired of it breaking down at the worst moment. Not cool", "Oxfess 3"]
["N/A", "N/A", "2020/11/13", "#OxfessThree13150", "Am I the only one who finds it astounding how many different ways British people manage to mispronounce \u2018foreign\u2019 last names?!", "Oxfess 3"]
["N/A", "N/A", "2020/11/13", "#OxfessThree13149", "What on earth is this chch room swap stuff? As a third year that's just one of the worst pandemic policies I've heard all term. How can you say \"no one should feel pressured to move out of their room\" when that is inevitably what will happen when some people have been much better at making friends this term than others for Very Obvious Reasons! Can you imagine the level of ostracisation you'll face by being a fresher who *already* felt lonely and now you're \u2026 See more", "Oxfess 3"]
["N/A", "N/A", "2020/11/13", "#OxfessThree13148", "There's nothing quite like seeing a zoom call of all your friends, on someone's insta story....", "Oxfess 3"]
["N/A", "N/A", "2020/11/13", "#OxfessThree13147", "fuck, and i cannot emphasise this enough, online tuition that we *somehow* still have to be in oxford for", "Oxfess 3"]
["N/A", "N/A", "2020/11/13", "#OxfessThree13146", "Has anyone else experienced this?In UK, I never got any compliments but when I went to Taiwan suddenly all the girls (and even boys) were complementing me and asking to take pictures with me? Is this something to do with different standards of beauty or the culture?", "Oxfess 3"]
["N/A", "N/A", "2020/11/13", "#OxfessThree13145", "anyone else feel like they might as well be in isolation for how well this term is going? households suck and all my 'friends' have better options.screw oxford for making us come this term, i want to go home.", "Oxfess 3"]
["N/A", "N/A", "2020/11/13", "#OxfessThree13144", "I'm worried that my best friend's girlfriend is jealous of our friendship. There's nothing romantic between us at all, but I'm worried that she is concerned about how much time we spend together hanging out alone together.", "Oxfess 3"]
