["N/A", "N/A", "2020/11/10", "#OxfessThree12872", "To the person in the room above mine:It may surprise you to learn that the sound of your unbelievably loud voice does not make reading Augustine's The City of God any more pleasurable.", "Oxfess 3"]
["N/A", "N/A", "2020/11/10", "#OxfessThree12870", "@admin comment: cw mental health issues. OP, if you feel it would help, the counselling service can be reached at https://www.ox.ac.uk/students/welfare/counselling. Further links to mental health resources can be found in the pinned post....\u2026 See more", "Oxfess 3"]
["N/A", "N/A", "2020/11/10", "#OxfessThree12869", "@admin comment: cw: alcoholism. OP, if you feel it would help, alcoholics anonymous can be found at 0800 917 7650 or www.alcoholics-anonymous.org.uk. Further links to resources can be found in the pinned post....\u2026 See more", "Oxfess 3"]
["N/A", "N/A", "2020/11/10", "#OxfessThree12868", "how the fuck do i disable email notifications from teams", "Oxfess 3"]
["N/A", "N/A", "2020/11/10", "#OxfessThree12867", "it's 4th week and i've only submitted 1 (one) problemsheet, and made some shit up to explain to tutors why I haven't handed in the 4 others I was supposed to do. My productivity is at its all time low. Holy fuck this term is going to be hard", "Oxfess 3"]
["N/A", "N/A", "2020/11/10", "#OxfessThree12866", "Quick request to everyone who has received a message from their Oxmatch - please reply! Nothing is more soul destroying than your message just being totally ignored. Even if you reply to say you're not interested, that's better than nothing, and at least the other person knows where they stand...", "Oxfess 3"]
["N/A", "N/A", "2020/11/10", "#OxfessThree12865", "When is it okay to start singing Christmas songs in Oxford? International Student asking...", "Oxfess 3"]
["N/A", "N/A", "2020/11/10", "#OxfessThree12864", "Eeekk okay so I\u2019m a very flirty person and I flirt with lots of my friends, but it\u2019s going a bit far with one of them and I think I might be taking it too far. I know it\u2019s not serious and I don\u2019t feel anything deeper for them but I\u2019m worried about the impact it\u2019ll have on my relationship with my partner. They\u2019re used to me being flirty but how do I reign myself in? Any tips?", "Oxfess 3"]
["N/A", "N/A", "2020/11/10", "#OxfessThree12863", "I have a crush on someone in my household, and I know I'm not the only one. Considering some things that have happened recently, I want to step back and let the other guy have their chance (they certainly seem to have a better shot than I do), but unfortunately that's not how having a crush works.", "Oxfess 3"]
["N/A", "N/A", "2020/11/10", "#OxfessThree12862", "To #OxfessThree12749: I feel exactly the same way. Only that I'm not sure if I'm even able to fall foolishly and passionately in love. What if I'm just so rational that I unintentionally suppress any \"foolish\" feeling before it can develop? Everyone says you don't expect to fall in love and that's kind of the point of it, but the likelihood of a person spontaneously falling in love with another person who is single and reciprocates the feeling is just so so \u2026 See more", "Oxfess 3"]
["N/A", "N/A", "2020/11/10", "#OxfessThree12861", "The Somerville meal booking system is just awful.", "Oxfess 3"]
["N/A", "N/A", "2020/11/10", "#OxfessThree12860", "Real ones know that Flower by Moby is the longest song in existence", "Oxfess 3"]
["N/A", "N/A", "2020/11/10", "#OxfessThree12859", "Once you get a scholars gown is it possible to lose it if you don\u2019t get a first in subsequent exams?", "Oxfess 3"]
["N/A", "N/A", "2020/11/10", "#OxfessThree12858", "When watching movies that aren't even fundamentally sad, such as \"Call me by your name\" I am filled with inexplicable sorrow that lasts for months and provokes me to cry. Why is that?", "Oxfess 3"]
["N/A", "N/A", "2020/11/10", "#OxfessThree12855", "If you think your life is going badly remember there are people who literally don't live in the autonomous state Kosovo ", "Oxfess 3"]
["N/A", "N/A", "2020/11/10", "#OxfessThree12853", "binder make gender euphoria go brrrrrrr", "Oxfess 3"]
["N/A", "N/A", "2020/11/10", "#OxfessThree12852", "[Comment removed by admins]@admin comment: we haven't edited this post in any way", "Oxfess 3"]
["N/A", "N/A", "2020/11/10", "#OxfessThree12851", "thank u camfess oxford needs this now", "Oxfess 3"]
["N/A", "N/A", "2020/11/10", "#OxfessThree12850", "I don't know if I'm being a spoiled brat here? Like AITA? But the scout in our staircase barely does anything, she didn't put anything in the loo roll holder even thought it was empty, she just put the new toilet rolls on top of the toilet, she didn't put new bin bags in the bins after cleaning them (all of these happened multiple times now and getting more frequent) shejust put the bag on top of the bin for us to put in, but then she'll be sitting around th\u2026 See more", "Oxfess 3"]
["N/A", "N/A", "2020/11/10", "#OxfessThree12849", "Leaked email reveals new University COVID-19 response:", "Oxfess 3"]
["N/A", "N/A", "2020/11/10", "#OxfessThree12846", "News just in: reciting Nicki Minaj quotes is, in fact, a substitute for a personality.", "Oxfess 3"]
["N/A", "N/A", "2020/11/10", "#OxfessThree12845", "i don't think ive met anyone else from a state non-selective school at oxford yet and it's pretty alienating. i come from a working class background, i failed the 11+ quite badly and ive no idea how i blagged my way in here. i was the first in my family to apply to oxford or cambridge, before i got in my mum would tell me they 'aren't for the likes of us'. none of this helping my impostor syndrome", "Oxfess 3"]
["N/A", "N/A", "2020/11/10", "#OxfessThree12844", "me after every tutorial", "Oxfess 3"]
["N/A", "N/A", "2020/11/10", "#OxfessThree12843", "all I want this lockdown is a tall broad-shouldered rugby player with blonde curtains, a quarter zip and excellent chat. too much to ask?", "Oxfess 3"]
["N/A", "N/A", "2020/11/10", "#OxfessThree12842", "just want college to be one bubble for lockdown", "Oxfess 3"]
["N/A", "N/A", "2020/11/10", "#OxfessThree12841", "anyone studying arabic - what books do you use in first year michaelmas??", "Oxfess 3"]
["N/A", "N/A", "2020/11/10", "#OxfessThree12840", "@admin comment: cw mental health issues. OP, if you feel it would help, the counselling service can be reached at https://www.ox.ac.uk/students/welfare/counselling. Further links to mental health resources can be found in the pinned post....\u2026 See more", "Oxfess 3"]
["N/A", "N/A", "2020/11/10", "#OxfessThree12839", "cw: suicideIf we have another pointless fire alarm I\u2019m going to drown myself in my toilet x", "Oxfess 3"]
["N/A", "N/A", "2020/11/10", "#OxfessThree12837", "How am I meant to know whether girls are single? I've asked out two girls with boyfriends already ", "Oxfess 3"]
["N/A", "N/A", "2020/11/10", "#OxfessThree12836", "Recommendations for places to sit that are outdoors but sheltered? Just went for a socially distanced walk in Port Meadow with someone from a different household, and got completely drenched in the rain because we couldn\u2019t go inside any restaurants or pubs ", "Oxfess 3"]
["N/A", "N/A", "2020/11/10", "#OxfessThree12835", "@ #OxfessThree12752 you sound rather dull, would be bored if you constantly told me not to be boring so that you could have more fun with no understanding about why I might not want to/ can\u2019t join in. People might not be dressing up because they don\u2019t like Halloween (cultural/religious/personal disagreement with the idea of it), have working to do or are doing another fun thing like going out not in a costume, having a Netflix Party or chatting to family... \u2026 See more", "Oxfess 3"]
["N/A", "N/A", "2020/11/10", "#OxfessThree12834", "what is mansfield like for grad students?? thinking of applying there next year", "Oxfess 3"]
["N/A", "N/A", "2020/11/10", "#OxfessThree12833", "@admin comment: cw depression. OP, if you feel it would help, the counselling service can be reached at https://www.ox.ac.uk/students/welfare/counselling. Further links to mental health resources can be found in the pinned post....\u2026 See more", "Oxfess 3"]
["N/A", "N/A", "2020/11/10", "#OxfessThree12832", "any good socs to join where youre likely to  find people who dont enjoy drinking? or any other tips? ://", "Oxfess 3"]
["N/A", "N/A", "2020/11/10", "#OxfessThree12830", "Boris really said no nut November but make it official huh", "Oxfess 3"]
["N/A", "N/A", "2020/11/10", "#OxfessThree12827", "Dear people of bnc that thing next to the toilet is the toilet brush for the love of god please learn how to use it (picture included for those who are unsure xoxo)", "Oxfess 3"]
["N/A", "N/A", "2020/11/10", "#OxfessThree12826", "@admin comment: OP, if you feel it would help, the counselling service can be reached at https://www.ox.ac.uk/students/welfare/counselling. Further links to mental health resources can be found in the pinned post.Spending 1 hour doing maths is fine. Spending 1 hour staring at a blank page because you don't even know where to start is soul destroying", "Oxfess 3"]
["N/A", "N/A", "2020/11/10", "We're having some issues with the submissions page at the moment, we hope to have them resolved by this evening/tomorrow. Oxlove are also having a similar issue", "The admins ", "Oxfess 3"]
["N/A", "N/A", "2020/11/5", "#OxfessThree12819", "Will deleting social media get rid of my body issues", "Oxfess 3"]
["N/A", "N/A", "2020/11/5", "#OxfessThree12818", "EVERYDAY LAVATORY EVENTS AS OXFORD COLLEGESAll Souls - erudite cubicle graffiti\u2026 See more", "Oxfess 3"]
["N/A", "N/A", "2020/11/5", "#OxfessThree12817", "tips on how to progress past a talking stage?? im desperate", "Oxfess 3"]
["N/A", "N/A", "2020/11/5", "#OxfessThree12816", "Will vape stores count as essential", "Oxfess 3"]
["N/A", "N/A", "2020/11/5", "#OxfessThree12815", "Shoutout to the st Hilda\u2019s poop bandit", "Oxfess 3"]
["N/A", "N/A", "2020/11/5", "#OxfessThree12814", "I'm falling for my college wife, how did this happen??!", "Oxfess 3"]
["N/A", "N/A", "2020/11/5", "#OxfessThree12813", "I don't want a lot for Christmas There is just one thing I need (And i) don't care about the presents Underneath the Christmas tree...", "Oxfess 3"]
["N/A", "N/A", "2020/11/5", "#OxfessThree12812", "Something med schoolDid not coverSomeone's daughterSomeone's mother\u2026 See more", "Oxfess 3"]
["N/A", "N/A", "2020/11/5", "#OxfessThree12811", "Sorry why would you bother shopping at Sainos when Tesco has the goods@admin comment: cos those spaghetti rings taste like arse", "Oxfess 3"]
["N/A", "N/A", "2020/11/5", "#OxfessThree12810", "still not college married and feeling anxious ab it - there were a few people I thought I could propose to but then iso hit over matriculation and now lockdown is gonna happen :(( fuck I wanna be college proposed to", "Oxfess 3"]
["N/A", "N/A", "2020/11/5", "#OxfessThree12809", "is having a cheese slicer a particularly middle-class thing to do??? i've always had one but am now being told it's very middle class?  confused", "Oxfess 3"]
["N/A", "N/A", "2020/11/5", "#OxfessThree12808", "Unus Annus", "Oxfess 3"]
["N/A", "N/A", "2020/11/5", "#OxfessThree12807", "To the people hosting house parties, you deserve to get deaned", "Oxfess 3"]
["N/A", "N/A", "2020/11/5", "#OxfessThree12806", "Is Irregardless a word?", "Oxfess 3"]
["N/A", "N/A", "2020/11/5", "#OxfessThree12805", "life at uni", "Oxfess 3"]
["N/A", "N/A", "2020/11/5", "#OxfessThree12804", "To the girl crying in the oxo bar toilets on Halloween, I hope that you\u2019re okay. Essays are hard and so is this degree, and it\u2019s okay to cry. Love from, a finalist", "Oxfess 3"]
["N/A", "N/A", "2020/11/5", "#OxfessThree12803", "Are any magdalen freshers not in self isolation?", "Oxfess 3"]
["N/A", "N/A", "2020/11/5", "#OxfessThree12802", "Youtube feels archaic by this point. Notifications are meh, comment sections have been totally neutered and there's no social functions whatever really. It feels like it's going to end up going the way of Myspace and Tumblr at some point. Still there, but not really.", "Oxfess 3"]
["N/A", "N/A", "2020/11/5", "#OxfessThree12801", "@admin comment: cw depression..OP, if you feel it would help, the counselling service can be reached at https://www.ox.ac.uk/students/welfare/counselling. Further links to mental health resources can be found in the pinned post....\u2026 See more", "Oxfess 3"]
["N/A", "N/A", "2020/11/5", "#OxfessThree12800", "@admin comment: cw self hate. OP, if you feel it would help, the counselling service can be reached at https://www.ox.ac.uk/students/welfare/counselling. Further links to mental health resources can be found in the pinned post....\u2026 See more", "Oxfess 3"]
["N/A", "N/A", "2020/11/5", "#OxfessThree12799", "Between Cherwell and OxStu which is the liberal one and which is the Liberal one", "Oxfess 3"]
["N/A", "N/A", "2020/11/5", "#OxfessThree12798", "Does anyone have an idea what the new \"ban on most international travel\" means for non-UK students? Will we be able to leave the UK and travel to our home country?", "Oxfess 3"]
["N/A", "N/A", "2020/11/5", "#OxfessThree12796", "Is anyone thinking of going home?", "Oxfess 3"]
["N/A", "N/A", "2020/11/5", "#OxfessThree12795", "Is anyone else (mainly first years, but this probably could apply to anyone) who feels really lonely right now? I\u2019m very introverted and find small-talk and mingling very difficult. When I\u2019m in a large group with people who I don\u2019t know well, I seem to completely socially shut down. I\u2019m better at fuller conversations with very small groups. It\u2019s week 4 now, and I\u2019m just finding it really hard to make friends. I\u2019ve met wonderful people and would say I now hav\u2026 See more", "Oxfess 3"]
["N/A", "N/A", "2020/11/5", "#OxfessThree12794", "Finally cracked and spent \u00a3500 on home gym equipment... Always chasing that pump", "Oxfess 3"]
["N/A", "N/A", "2020/11/5", "#OxfessThree12793", "One of my closest friends has openly said they won't follow lockdown rules, I've spoken to them about it but I can't change their mind. What do I do?", "Oxfess 3"]
["N/A", "N/A", "2020/11/5", "#OxfessThree12792", "pls buy me flowers. pls buy me flowers. flowers will make me so happy. cheap af tesco ones. i don't care about nice champagne, honestly just cheap flowers will make me feel loved like nothing else", "Oxfess 3"]
["N/A", "N/A", "2020/11/5", "#OxfessThree12790", "Strathlets (Strava athletes) - React with a like for miles, heart for kilometres.", "Oxfess 3"]
["N/A", "N/A", "2020/11/5", "#OxfessThree12789", "Can anyone recommend any good places to get south East Asian ingredients, especially things like sauces? Tesco and Sainsbury\u2019s just don\u2019t cut it", "Oxfess 3"]
["N/A", "N/A", "2020/11/5", "#OxfessThree12788", "Anyone know if Gloucester green market will remain open during lockdown, as it is technically all takeaway stalls and so should be exempted?", "Oxfess 3"]
["N/A", "N/A", "2020/11/5", "#OxfessThree12787", "@admin comment: OP, if you feel it would help, the counselling service can be reached at https://www.ox.ac.uk/students/welfare/counselling. Further links to mental health resources can be found in the pinned post.i was all for the first lockdown, for wearing masks, social distancing etc. but the prospect of a second lockdown has pushed me right over the edge and idk if i even want to be on this planet anymore. i had serious bereavement issues beforehand an\u2026 See more", "Oxfess 3"]
["N/A", "N/A", "2020/11/5", "#OxfessThree12786", "it really sucks that my mood changes every few minutes because of you. i hate it when you wake up but don\u2019t respond to my messages, but it makes me happy when you text me back. i should probably just grow up and let you go off my mind", "Oxfess 3"]
["N/A", "N/A", "2020/11/5", "#OxfessThree12785", "a simple choice~", "Oxfess 3"]
["N/A", "N/A", "2020/11/5", "#OxfessThree12784", "How on earth does this uni expect me to maintain my standard of work in the height of a global pandemic?", "Oxfess 3"]
["N/A", "N/A", "2020/11/5", "#OxfessThree12783", "how do i improve my chat (both irl and texting)?? failed too many talking stages due to my incompetency", "Oxfess 3"]
["N/A", "N/A", "2020/11/5", "#OxfessThree12782", "I think I'm going bald.", "Oxfess 3"]
["N/A", "N/A", "2020/11/5", "#OxfessThree12781", "Psychologists, Scientists - please help a girl out.I get very sad when watching movies that represent LGBT+ love. This sadness lasts months and I get outburst of cry when I listen to the soundtrack of the movie, or just think about it.\u2026 See more", "Oxfess 3"]
["N/A", "N/A", "2020/11/5", "#OxfessThree12780", "sorry, I panopted not to watch the lecture", "Oxfess 3"]
["N/A", "N/A", "2020/11/5", "#OxfessThree12779", "@admin comment: OP, if you feel it would help, the counselling service can be reached at https://www.ox.ac.uk/students/welfare/counselling. Further links to mental health resources can be found in the pinned post.feeling pretty miserable at uni, would much rather go back home before second lockdown hits. Are we allowed to go back or do we have to inform our tutors, I'm scared they're going to say no if I ask but at the same time, I can't stay sane here for\u2026 See more", "Oxfess 3"]
["N/A", "N/A", "2020/11/5", "#OxfessThree12778", "So much love and affection to the lads taking Henry the Hoover on tour through Oxford and up the castle mound  ", "Oxfess 3"]
["N/A", "N/A", "2020/11/5", "#OxfessThree12777", "@admin comment: OP, if you feel it would help, the counselling service can be reached at https://www.ox.ac.uk/students/welfare/counselling. Further links to mental health resources can be found in the pinned post.People call me a \"BNOC\", they tell me I'm well known and well liked, they tell me I have a lot of friends. So why do I feel more alone than I ever have before?", "Oxfess 3"]
["N/A", "N/A", "2020/11/5", "#OxfessThree12776", "the thought of chemistry finals being switched to online (they start tomorrow) is giving me mad anxiety :)) idek where i will sit them and I don\u2019t concentrate well in my room :)) nice that i will have time to process this :))", "Oxfess 3"]
["N/A", "N/A", "2020/11/5", "#OxfessThree12774", "BRASENOSE, UNITE!!", "Oxfess 3"]
["N/A", "N/A", "2020/11/5", "#OxfessThree12773", "@admin comment: cw loneliness. OP, if you feel it would help, the counselling service can be reached at https://www.ox.ac.uk/students/welfare/counselling. Further links to mental health resources can be found in the pinned post....\u2026 See more", "Oxfess 3"]
["N/A", "N/A", "2020/11/5", "#OxfessThree12772", "We're only 3 weeks into term and the situation is already worse than my worst fears for coming back to Oxford. I can't take another 5 weeks of this, when will they let us leave? I'm happy to quarantine at home for 2 weeks before interacting with my family if that's what it takes to keep them safe...", "Oxfess 3"]
["N/A", "N/A", "2020/11/5", "#OxfessThree12771", "Ha! There you go, lockdown. And I'm straight up vibin' at home. Have fun being miserable! ", "Oxfess 3"]
["N/A", "N/A", "2020/10/31", "#OxfessThree12736", "Thoughts on an Oxford indie rock society?idk how it'd work, probs a 24/7 discord channel queueing a playing and a discussion channel for any news (ex: the Strokes on SNL tomorrow!!)", "Oxfess 3"]
["N/A", "N/A", "2020/10/31", "#OxfessThree12733", "Bruh", "Oxfess 3"]
["N/A", "N/A", "2020/10/31", "#OxfessThree12725", "Oxhate to my college for using this confusing wording to describe leaving and returning to Oxford. We don\u2019t all live in the fucking home counties, Karen.@admin comment: this is another oxfordism, less common than others though", "Oxfess 3"]
["N/A", "N/A", "2020/10/30", "#OxfessThree12697", "The dream of every girl who's done their year abroad in France just came true xDDDD", "Oxfess 3"]
["N/A", "N/A", "2020/10/30", "#OxfessThree12676", "????", "Oxfess 3"]
["N/A", "N/A", "2020/10/30", "#OxfessThree12670", "Our pumpkin is honestly such a mood ", "Oxfess 3"]
["N/A", "N/A", "2020/10/30", "#OxfessThree12660", "When the nhs app tells you you\u2019re free to go outside again", "Oxfess 3"]
["N/A", "N/A", "2020/10/29", "#OxfessThree12652", "What does it mean if a girl I\u2019ve never spoken to liked a comment I made tagging my mate in a random post?", "Oxfess 3"]
["N/A", "N/A", "2020/10/29", "#OxfessThree12646", "When after 4 months of inner battle, you build up the courage to message your crush and... :", "Oxfess 3"]
["N/A", "N/A", "2020/10/29", "#OxfessThree12633", "To the person on Holywell St con la Bandera de la #2 Rep\u00fablica Espa\u00f1ola & LGBTQ+ flag hanging from their balcony - saludos, it made my day!", "Oxfess 3"]
["N/A", "N/A", "2020/10/29", "#OxfessThree12626", "When your only contact hour in a week is a pre-recorded lecture from 2019", "Oxfess 3"]
["N/A", "N/A", "2020/10/28", "#OxfessThree12595", "Credit to TC", "Oxfess 3"]
["N/A", "N/A", "2020/10/27", "#OxfessThree12574", "almost stepped on this monster in chch meadows someone pls tell me these aren't native to ox", "Oxfess 3"]
["N/A", "N/A", "2020/10/27", "#OxfessThree12572", "The Late Bronze Age Collapse (c. 1200 BC)", "Oxfess 3"]
["N/A", "N/A", "2020/10/27", "#OxfessThree12571", "@ Oxford English students", "Oxfess 3"]
["N/A", "N/A", "2020/10/27", "#OxfessThree12566", "make america DJUNGELSKOG again", "Oxfess 3"]
["N/A", "N/A", "2020/10/27", "#OxfessThree12565", "@admin comment: OP, if you feel it would help, the counselling service can be found at https://www.ox.ac.uk/students/welfare/counselling. Links to other resources can be found in the pinned post...\u2026 See more", "Oxfess 3"]
["N/A", "N/A", "2020/10/27", "#OxfessThree12561", "@admin comment: OP, if you feel it would help, you can find out more about the counselling service at https://www.ox.ac.uk/students/welfare/counselling. Links to other resources can be found in the pinned post....\u2026 See more", "Oxfess 3"]
["N/A", "N/A", "2020/10/27", "#OxfessThree12553", "Below is the fin of a poor shark that was served in a restaurant in Hongkong.Every year tens of millions of sharks die a slow death because of finning. Finning is the inhumane practice of hacking off the shark\u2019s fins and throwing its still living body back into the sea. The sharks either starve to death, are eaten alive by other fish, or drown (if they are not in constant movement their gills cannot extract oxygen from the water). Shark fins are being \u201charv\u2026 See more", "Oxfess 3"]
["N/A", "N/A", "2020/10/27", "#OxfessThree12552", "If you recognise this place, we should go on a date.", "Oxfess 3"]
["N/A", "N/A", "2020/10/27", "#OxfessThree12524", "Hi does anyone know where we can buy these? I don\u2019t like the other ones the Oxford shops sell, that are more kind of ribbed", "Oxfess 3"]
["N/A", "N/A", "2020/10/26", "#OxfessThree12523", "amen ", "Oxfess 3"]
["N/A", "N/A", "2020/10/26", "#OxfessThree12517", "oxhate to linear algebra sheet 1", "Oxfess 3"]
["N/A", "N/A", "2020/10/26", "#OxfessThree12513", "Vibes whilst waiting for the guy from Oxford council to come and deem our house uninhabitable ", "Oxfess 3"]
["N/A", "N/A", "2020/10/26", "#OxfessThree12509", "a day in my life: a cup of tea, a bar of chocolate, a problem in calculus cheers", "Oxfess 3"]
["N/A", "N/A", "2020/10/26", "#OxfessThree12498", "Hassan's has a new employee!", "Oxfess 3"]
["N/A", "N/A", "2020/10/26", "#OxfessThree12496", "feels after 250 hours in isolation in my tiny overpriced college room", "Oxfess 3"]
["N/A", "N/A", "2020/10/26", "#OxfessThree12485", "What are different colleges approach to households in isolation mixing if they've all got positive tests?? Insanity is close if I can see people soon", "Oxfess 3"]
["N/A", "N/A", "2020/10/26", "#OxfessThree12483", "#OxfessThree12464As a woman with also very small boobs - don\u2019t. I very rarely do (I haven\u2019t worn a bra regularly for about two years now) and my nipples look freaking great through a top. If anyone has a problem with it, that\u2019s their problem not mine. It makes life so much easier, and so much more comfortable!", "Oxfess 3"]
["N/A", "N/A", "2020/10/25", "#OxfessThree12481", "hello! I found this picture in a copy of Lectures on Public Economics by Joseph Stiglitz from the SSL! I've blocked out faces for privacy but if this is you pls comment and I can post it back to you!! it's a rly cute pic and it'd be a shame for it to live in the grimness of the SSL forever...", "Oxfess 3"]
["N/A", "N/A", "2020/10/25", "#OxfessThree12475", "Kind of irritating seeing everyone else's partner come up to visit from all over the country and them being super romantic when yours broke up before 0th week because the 0.5hr journey was too long ", "Oxfess 3"]
["N/A", "N/A", "2020/10/25", "#OxfessThree12448", "Can lots of 2nd/3rd years sign up for Oxmatch? Really want to have a decent match to go on a (legal) date with...", "Oxfess 3"]
["N/A", "N/A", "2020/10/24", "#OxfessThree12430", "The night climbers strike again ?!", "Oxfess 3"]
["N/A", "N/A", "2020/10/24", "#OxfessThree12417", "Hear me out: the college system is archaic and unnecessary and is retained to deliberately fragment the student body to dilute our collective voice and make it trickier to effect meaningful change across the university", "Oxfess 3"]
["N/A", "N/A", "2020/10/24", "#OxfessThree12409", "please could someone make a minecraft society so i can play minecraft with people and finally make some friends ", "Oxfess 3"]
["N/A", "N/A", "2020/10/23", "#OxfessThree12382", "Got some serious questions about the assassination of Abraham Lincoln. From this picture it looks completely unintentional, how could John Wilkes Booth have seen that Lincoln was there behind the traffic cone he was speaking into?", "Oxfess 3"]
["N/A", "N/A", "2020/10/23", "#OxfessThree12347", "Oxhate to New College. Just the whole place I'm ngl", "Oxfess 3"]
