["N/A", "N/A", "2020/11/15", "#OxloveTheThird20031", "I lost my silver necklace last night around St Giles . It was the last thing my grandma gifted me so it is important to me if anyone finds it xx", "Oxlove 3: electric troogaloo"]
["W", "W", "2020/11/15", "#OxloveTheThird20029", "Mary W@Worc you can take my V card anytimw", "Oxlove 3: electric troogaloo"]
["N/A", "N/A", "2020/11/15", "#OxloveTheThird20028", "I know you'll see this so - I understand how hard it is right now. You're allowed to feel sad, and complain, and vent. All of your friends, including me, will be here for you, no matter what. I know we've only been here for six weeks, but I see you as one of best friends already, and I really want the best for you x", "Oxlove 3: electric troogaloo"]
["N/A", "N/A", "2020/11/15", "#OxloveTheThird20027", "sorry I'm bad at replying, still like you though xx", "Oxlove 3: electric troogaloo"]
["N/A", "N/A", "2020/11/15", "#OxloveTheThird20026", "Oxlove to my fellow rock licker freshers @StAs - u guys are gems. I love our film nights ", "Oxlove 3: electric troogaloo"]
["N/A", "N/A", "2020/11/15", "#OxloveTheThird20025", "Sometimes I feel all bubbly after going on a date with a  h o t  guy and think \"what if I am actually straight\" and then I spend two hours binge-watching wlm tiktok compilations on YouTube when I should be doing work and just", "Oxlove 3: electric troogaloo"]
["N/A", "N/A", "2020/11/15", "#OxloveTheThird20024", "Oxlove to French @ Magd for their stunning performance on Friday night, deserved winners", "Oxlove 3: electric troogaloo"]
["N/A", "N/A", "2020/11/15", "#OxloveTheThird20023", "oxlove 2 ppl whose love language is physical touch, this covid shit is rough ", "Oxlove 3: electric troogaloo"]
["EK", "K", "2020/11/15", "#OxloveTheThird20022", "Oxlove to EK@K. The best accommodation officer!", "Oxlove 3: electric troogaloo"]
["N/A", "N/A", "2020/11/15", "#OxloveTheThird20021", "Oxlove to the Lincoln CRED reps the interfaith video made my day", "Oxlove 3: electric troogaloo"]
["AH", "SH", "2020/11/15", "#OxloveTheThird20020", "Oxlove to AH@SH hope labs don't destroy you before the end of MT", "Oxlove 3: electric troogaloo"]
["N/A", "N/A", "2020/11/15", "#OxloveTheThird20019", "Oxlove to my guitar for being literally the only thing that gets me trough this degree (and to my household for putting up with this)!", "Oxlove 3: electric troogaloo"]
["R", "C", "2020/11/15", "#OxloveTheThird20016", "R @ Catz is the fittest third year no contest", "Oxlove 3: electric troogaloo"]
["N/A", "N/A", "2020/11/15", "#OxloveTheThird20015", "Oxlove to anyone on year abroad doing lockdown by themselves - hang in there you can do this! Xx", "Oxlove 3: electric troogaloo"]
["CS", "Q", "2020/11/15", "#OxloveTheThird20014", "CS@Q, I'm stuck in the washing machine, please help me step bro xx ", "Oxlove 3: electric troogaloo"]
["N/A", "N/A", "2020/11/15", "#OxloveTheThird20013", "oxlove to accom officer @k !! u really pulled it off super nicely and fairly!! hope no one is giving you shit", "Oxlove 3: electric troogaloo"]
["N/A", "N/A", "2020/11/15", "#OxloveTheThird20012", "oxlove to the little clarendon street taylor\u2019s playlist \u2014 straight banger after banger ", "Oxlove 3: electric troogaloo"]
["WS", "W", "2020/11/15", "#OxloveTheThird20011", "oxlove to WS@W our purple haired king", "Oxlove 3: electric troogaloo"]
["N/A", "N/A", "2020/11/15", "#OxloveTheThird20010", "Oxlove to sleep, I miss you xoxo catch up after lockdown?", "Oxlove 3: electric troogaloo"]
["N/A", "N/A", "2020/11/15", "#OxloveTheThird20009", "How do I deal with a situation where we both like each other, but I'm not really ready/interested in doing much more than kissing? Am I the only college student who wants their first experiences to be really special (or at least be with someone you've been for 4+ months)? I feel like we're on different pages but I don't know how to communicate it , so I kind of just invent excuses or avoid him when he tries to take it further.", "Oxlove 3: electric troogaloo"]
["N/A", "N/A", "2020/11/15", "#OxloveTheThird20007", "I\u2019m TRYING to start something with you!! literally just come to my room I will make out with you come ONNNNNNNN", "Oxlove 3: electric troogaloo"]
["N/A", "N/A", "2020/11/15", "#OxloveTheThird20006", "Oxlove to Pembroke college. Genuinely the loveliest college ever, everybody is so sweet and kind ", "Oxlove 3: electric troogaloo"]
["N/A", "N/A", "2020/11/15", "#OxloveTheThird20005", "Oxlove to Taylor swift personally dragging me through each problem sheet crisis, if I come out with a degree it will be as much hers as it is mine", "Oxlove 3: electric troogaloo"]
["N/A", "N/A", "2020/11/15", "#OxloveTheThird20004", "Oxlove to week 2 for being so painfully depressing that 5th week blues cannot affect me ", "Oxlove 3: electric troogaloo"]
["N/A", "N/A", "2020/11/15", "#OxloveTheThird20003", "Oxlove to the Polish bread at Tesco, oxhate to British bread, wtf is that guys??", "Oxlove 3: electric troogaloo"]
["DA", "M", "2020/11/15", "#OxloveTheThird20002", "Phattest Oxlove to DA@M and his appreciation for Angus Thongs and Perfect Snogging! I\u2019d dress up as a stuffed olive for you any day xx", "Oxlove 3: electric troogaloo"]
["RJ", "Q", "2020/11/15", "#OxloveTheThird20000", "Is RJ @ Q single?!", "Oxlove 3: electric troogaloo"]
["N/A", "N/A", "2020/11/15", "#OxloveTheThird19998", "Oxlove to Ruby P @st hughs. Nice, fun, and entertaining, one of the most special ppl of college ", "Oxlove 3: electric troogaloo"]
["N/A", "N/A", "2020/11/15", "#OxloveTheThird19997", "Oxlove to a bottle of red which always gets me the perfect amount of drunk", "Oxlove 3: electric troogaloo"]
["MA", "P", "2020/11/15", "#OxloveTheThird19995", "MJ and MA @P are you guys a thing ???", "Oxlove 3: electric troogaloo"]
["JS", "O", "2020/11/15", "#OxloveTheThird19994", "JS@O you are one gorgeous man", "Oxlove 3: electric troogaloo"]
["N/A", "N/A", "2020/11/15", "#OxloveTheThird19993", "Oxlove to my ex, oxlove to the future, and oxlove to \"Holding Out for a Hero\" by Bonnie Tyler ", "Oxlove 3: electric troogaloo"]
["N/A", "N/A", "2020/11/15", "#OxloveTheThird19992", "Oxlove to hot Catholic girls", "Oxlove 3: electric troogaloo"]
["N/A", "N/A", "2020/11/15", "#OxloveTheThird19991", "#oxlovethethird19147I'll do you one better: as far as I'm concerned every uninitialled oxlove is for me. My love life is clearly far more dramatic than I ever remember, but damn do I appreciate y'alls adoration", "Oxlove 3: electric troogaloo"]
["N/A", "N/A", "2020/11/15", "#OxloveTheThird19990", "Ox love to the person at Hertford who rhymes with ladi Makani. Love you man xx", "Oxlove 3: electric troogaloo"]
["TC", "O", "2020/11/15", "#OxloveTheThird19988", "Oxlove to TC @ O for putting your best jumper in the recycling bin", "Oxlove 3: electric troogaloo"]
["N/A", "N/A", "2020/11/15", "#OxloveTheThird19987", "Oxlove to the sexy headboy at Hildas. U know who u r u sexy yoggo boy ", "Oxlove 3: electric troogaloo"]
["N/A", "N/A", "2020/11/15", "#OxloveTheThird19986", "I have such a weakness for girls with good music taste ugghhhhh.", "Oxlove 3: electric troogaloo"]
["N/A", "N/A", "2020/11/15", "#OxloveTheThird19985", "Oxlove to the people throwing tennis balls to each other on Holywell tonight (13/11). Really made me feel happy that you guys were enjoying yourselves", "Oxlove 3: electric troogaloo"]
["N/A", "N/A", "2020/11/15", "#OxloveTheThird19983", "Oxlove to all Italians at uni, but especially VS, hoping you\u2019re single?", "Oxlove 3: electric troogaloo"]
["N/A", "N/A", "2020/11/15", "#OxloveTheThird19982", "oxlove to the kid riding around cowley clinging to his fathers waist as he scooted, you warmed my heart and you looked so classy in your long coat ", "Oxlove 3: electric troogaloo"]
["N/A", "N/A", "2020/11/15", "#OxloveTheThird19981", "Oxlove to whoever was playing the Bach cello suites in one of the colleges backing on to Queens Lane at 21.00 on Friday evening - such a nice thing to hear when walking back from the library after a long day!", "Oxlove 3: electric troogaloo"]
["N/A", "N/A", "2020/11/15", "#OxloveTheThird19980", "oxlove to JB @hilda\u2019s touch me like im your clay", "Oxlove 3: electric troogaloo"]
["N/A", "N/A", "2020/11/15", "#OxloveTheThird19979", "Oxlove to my friend Tommy (2002-2017), been 3 years and it still feels like yesterday. Can\u2019t help but feel we could\u2019ve done so much more for you when you were still alive. Till we meet again ", "Oxlove 3: electric troogaloo"]
["JD", "SJC", "2020/11/15", "#OxloveTheThird19978", "Oxlove to JD@SJC I really loved you on Masterchef junior Spain, I\u2019d love you to poach my egg some time xx", "Oxlove 3: electric troogaloo"]
["N/A", "N/A", "2020/11/15", "#OxloveTheThird19977", "oxlove to wadham for organising the best queer week", "Oxlove 3: electric troogaloo"]
["N/A", "N/A", "2020/11/15", "#OxloveTheThird19975", "oxlove to the postal service of wadham, u make iso a blast x", "Oxlove 3: electric troogaloo"]
["N/A", "N/A", "2020/11/15", "#OxloveTheThird19974", "to the stunning girl whom i saw on thursday, first passing st mary's passage and then again in uni parks with a different friend, you looked fab, your monochrome outfit was fab, and your hair was fab.", "Oxlove 3: electric troogaloo"]
["N/A", "N/A", "2020/12/23", "#OxloveTheThird19973", "What's a gathering of DJUNGLESKOGs called? -heart react for 'a chungus'-wow react for 'a chungi'-care react for 'a chungle'\u2026 See more", "Oxlove 3: electric troogaloo"]
["N/A", "N/A", "2020/11/14", "#OxloveTheThird19972", "Henry the Hoover you arouse me every night, can you please get your negative pressure focused on me ", "Oxlove 3: electric troogaloo"]
["N/A", "N/A", "2020/11/14", "#OxloveTheThird19971", "Oxlove to all those celebrating Diwali today! Stay safe and positive and don't forget to connect with loved ones. It may be different this year but always keep your head and spirit high!", "Oxlove 3: electric troogaloo"]
["N/A", "N/A", "2020/11/14", "#OxloveTheThird19970", "Oxhate to people who rely on their friends to bring them up the room ballots. Put in your own work!!", "Oxlove 3: electric troogaloo"]
["N/A", "N/A", "2020/11/14", "#OxloveTheThird19969", "Oxlove to JF for being one of the few persons who was willing to chat w me during fresher\u2019s week and self-iso!! You probably don\u2019t use fb that much but in case you see this - Youre a gem and you made my ox social life much better although we\u2019ve only met for a few times! thank you!!!!", "Oxlove 3: electric troogaloo"]
["N/A", "N/A", "2020/11/14", "#OxloveTheThird19968", "Oxlove to the man I wish I could be with. I\u2019ll probably never have it in me to be upfront with you about how I feel (and I\u2019d get rejected even if I was) but please know I adore you.", "Oxlove 3: electric troogaloo"]
["N/A", "N/A", "2020/11/14", "#OxloveTheThird19967", "ngl I\u2019m kinda bored of sex", "Oxlove 3: electric troogaloo"]
["N/A", "N/A", "2020/11/14", "#OxloveTheThird19966", "Oxlove to the Gainflete @magd my g\u2019s  Special shout-out to @FO for being the best college wife and keeping me motivated ", "Oxlove 3: electric troogaloo"]
["N/A", "N/A", "2020/11/14", "#OxloveTheThird19965", "how mentally not coping do i have to be for college to let me suspend?", "Oxlove 3: electric troogaloo"]
["LP", "H", "2020/11/14", "#OxloveTheThird19964", "Oxlove to LP @ Hugh's... gingers really do have souls?? x", "Oxlove 3: electric troogaloo"]
["N/A", "N/A", "2020/11/14", "#OxloveTheThird19963", "oxlove to the girl at Mansfield who was roller skating around the quad in the evening! that\u2019s some queen shit right there. good energy. straight up vibing. will bring some skates next term. hope you had fun!", "Oxlove 3: electric troogaloo"]
["N/A", "N/A", "2020/11/14", "#OxloveTheThird19962", "I hate the union but oxlove to seeing a genuinely diverse slate for once", "Oxlove 3: electric troogaloo"]
["N/A", "N/A", "2020/11/14", "#OxloveTheThird19961", "Huge OXLOVE to the amazing welfare reps at St Hilda's!! Only thing keeping me going through 5th week blues ", "Oxlove 3: electric troogaloo"]
["N/A", "N/A", "2020/11/14", "#OxloveTheThird19960", "I don\u2019t know why it\u2019s been so hard for me to say thisI\u2019m not exactly gay, but sure as hell ain\u2019t straight, sisIf I\u2019m honest I fall somewhere in the middle A little\u2026 See more", "Oxlove 3: electric troogaloo"]
["N/A", "N/A", "2020/11/14", "#OxloveTheThird19959", "Oxlove to SBE for being the most perfect fresher at Worcester  you are gorgeous, smart and funny - by any chance are you into girls?", "Oxlove 3: electric troogaloo"]
["AA", "M", "2020/11/14", "#OxloveTheThird19958", "Oxlove to AA@Mans for the cookies (again)", "Oxlove 3: electric troogaloo"]
["N/A", "N/A", "2020/11/14", "#OxloveTheThird19957", "To the musician in Toynbee@LMH playing Chopin\u2019s waltzes, you play so nicely and it made my evening ", "Oxlove 3: electric troogaloo"]
["MM", "LMH", "2020/11/14", "#OxloveTheThird19956", "MM @LMH thank you for being the sweetest human being ever!!! P.S pls  check your pidge :))", "Oxlove 3: electric troogaloo"]
["N/A", "N/A", "2020/11/14", "#OxloveTheThird19955", "Oxlove to ES - even though you\u2019re not in Oxford anymore you\u2019re still managing to brighten my days ", "Oxlove 3: electric troogaloo"]
["N/A", "N/A", "2020/11/14", "#OxloveTheThird19953", "I miss fucking strangers", "Oxlove 3: electric troogaloo"]
["N/A", "N/A", "2020/11/14", "#OxloveTheThird19952", "Yo posh ginger girl sat in the radcamYou\u2019re fit but my gosh don\u2019t you know it", "Oxlove 3: electric troogaloo"]
["N/A", "N/A", "2020/11/14", "#OxloveTheThird19951", "oxlove to spaghetti on toast", "Oxlove 3: electric troogaloo"]
["N/A", "N/A", "2020/11/14", "#OxloveTheThird19950", "When you don't even drop me a text throughout the day, it makes me wonder if you actually like me or just want a fling. Text me goddamit before I get away!", "Oxlove 3: electric troogaloo"]
["N/A", "N/A", "2020/11/14", "#OxloveTheThird19949", "massive oxlove to balliol welfare reps for trekking into deep dark Cowley to deliver our  best cure for fifth week blues", "Oxlove 3: electric troogaloo"]
["N/A", "N/A", "2020/11/14", "#OxloveTheThird19948", "Oxlove to the cute guy @ magd who I keep seeing in the same bit of the deer park ", "Oxlove 3: electric troogaloo"]
["N/A", "N/A", "2020/11/14", "#OxloveTheThird19946", "Oxlove to the girl with the orange hair and cool clothes!! You might be the most beautiful girl Ive ever seen...I cant stop thinking abt you... :00", "Oxlove 3: electric troogaloo"]
["N/A", "N/A", "2020/11/14", "#OxloveTheThird19945", "David Marshall you danceryes sir I can boogie", "Oxlove 3: electric troogaloo"]
["N/A", "N/A", "2020/11/14", "#OxloveTheThird19944", "hey all you proud  American  sluts  we\u2019ve got a brand new  president  ERECT  say BYE  BITCH  to short dick  Trump  and welCUM  our new daddy  Biden  we are MAKING  AMERICA  SLUTTY  AGAIN  get ready to pop  some champagne and pop that pussy  cause we gettin FREAKY tonight  whether you\u2019re poor  or white  we are ALL getting some of that executive DICK  from our new CUMmander in chief send this to  of your slutti\u2026 See more", "Oxlove 3: electric troogaloo"]
["N/A", "N/A", "2020/11/14", "#OxloveTheThird19943", "Me letting you insult Taylor Swift is something beyond love.", "Oxlove 3: electric troogaloo"]
["N/A", "N/A", "2020/11/14", "#OxloveTheThird19940", "Got a crush on a friend who's turned me down before - ask them out again - try to get over them", "Oxlove 3: electric troogaloo"]
["N/A", "N/A", "2020/11/14", "#OxloveTheThird19938", "AS @some hope you have a fab birthday despite being stuck in isolation ", "Oxlove 3: electric troogaloo"]
["ZA", "H", "2020/11/14", "#OxloveTheThird19937", "Oxlove to NK and ZA @Hilda\u2019s for working so hard through term to keep everyone welfared and for putting on an amazing welfare week! You guys are the best xx", "Oxlove 3: electric troogaloo"]
["N/A", "N/A", "2020/11/14", "#OxloveTheThird19936", "Getting head from a philosophy student is a real mind fuck", "Oxlove 3: electric troogaloo"]
["OK", "J", "2020/11/14", "#OxloveTheThird19935", "Oxlove to OK@J, just want to see that abs bby", "Oxlove 3: electric troogaloo"]
["N/A", "N/A", "2020/11/14", "#OxloveTheThird19934", "Oxlove to Rina, you drive me crazy too baby xo", "Oxlove 3: electric troogaloo"]
["JJDC", "J", "2020/11/14", "#OxloveTheThird19933", "Oxlove to JJDC@J, you just seem like a really nice guy", "Oxlove 3: electric troogaloo"]
["N/A", "N/A", "2020/11/14", "#OxloveTheThird19931", "Ringing my Ox friends who live far out is the only acceptable Catz call", "Oxlove 3: electric troogaloo"]
["N/A", "N/A", "2020/11/14", "#OxloveTheThird19930", "In willing to make one of you internationals a national real quick ", "Oxlove 3: electric troogaloo"]
["N/A", "N/A", "2020/11/14", "#OxloveTheThird19929", "Massive fucking oxhate to myself. I need to stop making the same mistakes over and over and OVER again. Fucking embarrassing", "Oxlove 3: electric troogaloo"]
["N/A", "N/A", "2020/11/14", "#OxloveTheThird19928", "oxlove to me, never ceases to amaze me  how i have the biggest brain in this hell city", "Oxlove 3: electric troogaloo"]
["N/A", "N/A", "2020/11/14", "#OxloveTheThird19927", "#oxlaugh to all the Tories who supported Brexit because the EU was \"unelected and unaccountable\" and yet accept Dominc Cummings despite the fact that he's...well...\"unelected and unaccountable\".", "Oxlove 3: electric troogaloo"]
["RW", "M", "2020/11/14", "#OxloveTheThird19926", "RW@M what if we kissed under Mount Wesuwius UwU", "Oxlove 3: electric troogaloo"]
["N/A", "N/A", "2020/11/14", "#OxloveTheThird19925", "OxHATE to the tree surgeons directly outside the st hughs library on Friday. would u kindly stop making a racket i'm having a crisis xx", "Oxlove 3: electric troogaloo"]
["N/A", "N/A", "2020/11/14", "#OxloveTheThird19924", "oxlove to the girl in funky leggings and a butterfly top cause she is clearly thriving", "Oxlove 3: electric troogaloo"]
["N/A", "N/A", "2020/11/14", "#OxloveTheThird19923", "COUGH  COUGH  SLUTS JUST BECAUSE BORIS  HAS US  IN LOCKDOWN  DOESN\u2019T  MEAN  WE CAN\u2019T  GET  DICKED  DOWN  BY  DADDY  COVID  IT\u2019S  TIME  TO RAM  THAT  SWAB DOWN YOUR  MOUTH THRUSSY  (THROAT PUSSY)  AND THEN  PENETRATE  THAT  NASAL PROSTATE  IF YOU\u2019RE  POSITIVE  KEEP THEM  MASKS  AND  GAGS  ON BUT LET THE  SEX  GET HOTTER  THAN YOUR FEVER  TRANSMIT  THIS TO FIVE  OF YOUR \u2026 See more", "Oxlove 3: electric troogaloo"]
["N/A", "N/A", "2020/11/14", "#OxloveTheThird19922", "OxRIP to Raffiki @BNC the best set of wheels we could have asked for", "Oxlove 3: electric troogaloo"]
["LK", "C", "2020/11/14", "#OxloveTheThird19921", "The hugest oxlove to LK@Catz for being there for me when I really really needed a friend the other night - you are so incredibly wonderful and how you managed to deal with my blubbering butt at 6am I\u2019ll never know! Love you endlessly!!!!!", "Oxlove 3: electric troogaloo"]
["SD", "H", "2020/11/14", "#OxloveTheThird19920", "Oxlove to SD @ H - we love randomly bumping into you. Love your BNC friends", "Oxlove 3: electric troogaloo"]
["N/A", "N/A", "2020/11/14", "#OxloveTheThird19919", "My heart sinksand rises at the same, Time scattered by moments,Shattered and chastened,\u2026 See more", "Oxlove 3: electric troogaloo"]
["N/A", "N/A", "2020/11/14", "#OxloveTheThird19918", "oxlove to the cherwell website because she always seems so broken", "Oxlove 3: electric troogaloo"]
["N/A", "N/A", "2020/11/14", "#OxloveTheThird19917", "Girl in the green jumper and blue puffer jacket, your smile made my day xoxo", "Oxlove 3: electric troogaloo"]
["N/A", "N/A", "2020/11/14", "#OxloveTheThird19916", "Oxhate to Tesco self-checkout STOP CALLING FOR ASSISTANCE", "Oxlove 3: electric troogaloo"]
["N/A", "N/A", "2020/11/14", "#OxloveTheThird19915", "Big oxhate to sharking, saying you'd shark someone isn't a compliment it's predatory", "Oxlove 3: electric troogaloo"]
["H-M", "W", "2020/11/14", "#OxloveTheThird19914", "Oxlove to A H-M @Wadham,Ask me out already xxxxxx", "Oxlove 3: electric troogaloo"]
["N/A", "N/A", "2020/11/14", "#OxloveTheThird19913", "Oxlove to the Worcester dining hall berry brulee 12/11. Tasted like home and I went into a full nostalgia breakdown after I had it. 10/10 would consume again", "Oxlove 3: electric troogaloo"]
["N/A", "N/A", "2020/11/14", "#OxloveTheThird19911", "Oxhate to me and everything I do. It's well deserved, but no-one else will write it for me.", "Oxlove 3: electric troogaloo"]
["N/A", "N/A", "2020/11/14", "#OxloveTheThird19910", "oxhate to eduroam. The stress of wifi failing when I'm handing in an essay 5 minutes before the deadline is not the one", "Oxlove 3: electric troogaloo"]
["JC", "SPC", "2020/11/14", "#OxloveTheThird19909", "JC@SPC I wish you appreciated yourself as much as we all appreciate you!! Keep going, Queen! x", "Oxlove 3: electric troogaloo"]
["KB", "SJC", "2020/11/14", "#OxloveTheThird19908", "oxlove to KB@SJC can't wait to embarrass myself in front of you by getting mild sauce at nandos", "Oxlove 3: electric troogaloo"]
["N/A", "N/A", "2020/11/14", "#OxloveTheThird19907", "I don\u2019t even want a relationship... I just need someone to kiss and snuggle in bed with because I feel cold at night", "Oxlove 3: electric troogaloo"]
["N/A", "N/A", "2020/11/14", "#OxloveTheThird19906", "Sad. I said I wasn't upset but of course I am disappointed. Maybe you're right and I don't know what I'm saying, but I did mean it. I'm so sorry to have caused you so much emotional turmoil, hope you forgive me.", "Oxlove 3: electric troogaloo"]
["N/A", "N/A", "2020/11/14", "#OxloveTheThird19904", "Oxhate to feeling like an outsider because the porters won't listen to you when you say your surname is spelled with a &quot;Zh&quot; not a &quot;J&quot;. The ignorance is so hurtful ", "Oxlove 3: electric troogaloo"]
["KO", "CCC", "2020/11/14", "#OxloveTheThird19903", "oxlove to KO@CCC you\u2019re cool and deserve the appreciation", "Oxlove 3: electric troogaloo"]
["KL", "SEH", "2020/11/14", "#OxloveTheThird19901", "Oxlove to KL@SEH don\u2019t know you well but you\u2019re very cute", "Oxlove 3: electric troogaloo"]
["ZK", "J", "2020/11/14", "#OxloveTheThird19900", "oxlove to ZK @ J, keep going dude, you got this!!", "Oxlove 3: electric troogaloo"]
["N/A", "N/A", "2020/11/14", "#OxloveTheThird19899", "Do you really love me? Because it sure doesn\u2019t fucking seem it in public", "Oxlove 3: electric troogaloo"]
["N/A", "N/A", "2020/11/14", "#OxloveTheThird19898", "Wisdom truly comes from great people\u2026[photo description: Donald Trump \u201ctweets\u201d \u201cI aint never seen two pretty best friends\u201d]", "Oxlove 3: electric troogaloo"]
["N/A", "N/A", "2020/11/14", "#OxloveTheThird19897", "Anyone else finding lockdown means too much time to contemplate your ex?", "Oxlove 3: electric troogaloo"]
["TT", "W", "2020/11/14", "#OxloveTheThird19896", "Oxlove to GMC and TT @ Worcester for being such amazing welfare reps, you're not appreciated enough! Thank you for everything!", "Oxlove 3: electric troogaloo"]
["N/A", "N/A", "2020/11/14", "#OxloveTheThird19895", "You probably won\u2019t read this but I miss you, A. Come back, please.", "Oxlove 3: electric troogaloo"]
["N/A", "N/A", "2020/11/14", "#OxloveTheThird19894", "She do be perfect though - makes me sad", "Oxlove 3: electric troogaloo"]
["N/A", "N/A", "2020/11/14", "#OxloveTheThird19893", "Sorry to the girl in the bench with her friend that I scared by balliol/hassans kebab van last night with my doggo", "Oxlove 3: electric troogaloo"]
["CW", "C", "2020/11/14", "#OxloveTheThird19891", "Biggest Oxlove to the angel that is CW @ Catz. So happy I got to meet you, you have impeccable music & drinks tastes and I can\u2019t wait to meet you irl and have fun movie nights/vibe to ABBA/eat snacks and chat ", "Oxlove 3: electric troogaloo"]
["TB", "SJC", "2020/11/14", "#OxloveTheThird19889", "TB @ SJC you are the most based person I have ever met", "Oxlove 3: electric troogaloo"]
["N/A", "N/A", "2020/11/14", "#OxloveTheThird19888", "earth sciences hahaha wtf", "Oxlove 3: electric troogaloo"]
["N/A", "N/A", "2020/11/14", "#OxloveTheThird19887", "Oxlove to cereal straight out the box", "Oxlove 3: electric troogaloo"]
["N/A", "N/A", "2020/11/14", "#OxloveTheThird19886", "oxlove to my wraps! If anyone disses me for my weird wrap choices anymore I\u2019ll be throwing fists:)", "Oxlove 3: electric troogaloo"]
["N/A", "N/A", "2020/11/14", "#OxloveTheThird19885", "Oxlove to my small room if it gives me a large room next year", "Oxlove 3: electric troogaloo"]
["N/A", "N/A", "2020/11/14", "#OxloveTheThird19883", "Oxlove to whoever sent me the anonymous Freddo via nightline - it's much appreciated!", "Oxlove 3: electric troogaloo"]
["LB", "W", "2020/11/14", "#OxloveTheThird19882", "LB@Wad I want to part your curtains", "Oxlove 3: electric troogaloo"]
["AH", "S", "2020/11/14", "#OxloveTheThird19881", "AH@S take my V card", "Oxlove 3: electric troogaloo"]
["WH", "S", "2020/11/14", "#OxloveTheThird19880", "WH @ Some I think we've got some serious Chemistry hmu", "Oxlove 3: electric troogaloo"]
["N/A", "N/A", "2020/11/14", "#OxloveTheThird19878", "OXLOVE TO SCOTTISH MENYUM", "Oxlove 3: electric troogaloo"]
["N/A", "N/A", "2020/11/14", "#OxloveTheThird19877", "To DJUNGELSKOG in #OxloveTheThird19746I\u2019m on holiday in  Rn but would love coffee with you when I\u2019m back as I\u2019m single and ready to Pringle", "Oxlove 3: electric troogaloo"]
["N/A", "N/A", "2020/11/14", "#OxloveTheThird19875", "Just want a Jewish guy to flirt with", "Oxlove 3: electric troogaloo"]
["EW", "S", "2020/11/14", "#OxloveTheThird19874", "EW@S thank you for being my therapist, advisor and wife  Couldn\u2019t have done the last month without you boo x", "Oxlove 3: electric troogaloo"]
