["N/A", "N/A", "2020/09/22", "#OxloveTheThird16678", "Need advice please!My bf of almost 2 years recently (few months back) became friends with his long-term ex again. They were high school sweethearts, were dating for 5 years, in the same friendship group. Bf only now felt comfortable to get back in contact with her after recently meeting her at a get together with his friends a few months back. It was her bday a few weeks ago or so back so in his usual lovely self, he wished her a happy birthday (he does\u2026 See more", "Oxlove 3: electric troogaloo"]
["N/A", "N/A", "2020/09/21", "#OxloveTheThird16664", "Has anyone actually completed the New College seven?", "Oxlove 3: electric troogaloo"]
["N/A", "N/A", "2020/09/21", "#OxloveTheThird16649", "another would be oxfess but when do people start looking for private renting for the next year? what websites should I look at and stuff any advice would be beyond appreciated <333", "Oxlove 3: electric troogaloo"]
["N/A", "N/A", "2020/09/20", "#OxloveTheThird16618", "Flirting in quarantine be like", "Oxlove 3: electric troogaloo"]
["N/A", "N/A", "2020/09/20", "#OxloveTheThird16592", "oxlove to exeter", "Oxlove 3: electric troogaloo"]
["N/A", "N/A", "2020/09/19", "#OxloveTheThird16556", "It may not be termtime, but with all the sadness in the news every day at the moment, perhaps a baby moose could still be of help ", "Oxlove 3: electric troogaloo"]
["N/A", "N/A", "2020/09/19", "#OxloveTheThird16546", "#OxloveTheThird16526I also do yh, it ebbs and flows so some months/weeks  it\u2019s worse than others. Any tips to help it I\u2019d be grateful to know. Typically talking with ppl helps me but that\u2019s not always possible (especially given current circumstances)", "Oxlove 3: electric troogaloo"]
["N/A", "N/A", "2020/09/18", "#OxloveTheThird16521", "I can never remember who Patrick Bateman is so whenever I hear the name I think of somebody at Oxford named Patrick and it's really confusing", "Oxlove 3: electric troogaloo"]
["N/A", "N/A", "2020/09/18", "#OxloveTheThird16510", "183", "Oxlove 3: electric troogaloo"]
["N/A", "N/A", "2020/09/18", "#OxloveTheThird16500", "Bones, bones, glorious bones", "Oxlove 3: electric troogaloo"]
["GB", "S", "2020/09/18", "#OxloveTheThird16496", "GB @ S u may not live in london but you live in our hearts <333", "Oxlove 3: electric troogaloo"]
["N/A", "N/A", "2020/09/18", "#OxloveTheThird16494", "Oxlove to mathematicians. That degree has the funniest and most wholesome students and I\u2019m sorry lesser beings don\u2019t get your sense of humour all the time, it\u2019s ok, you\u2019re just smarter than them. Just know that you are loved and we appreciate you, keep making each other laugh and sometimes (if they\u2019re lucky) everyone else, too.", "Oxlove 3: electric troogaloo"]
["N/A", "N/A", "2020/09/18", "#OxloveTheThird16473", "#OxloveTheThird16419xxx", "Oxlove 3: electric troogaloo"]
["N/A", "N/A", "2020/09/18", "#OxloveTheThird16464", "When you make it to 3rd year at Oxford", "Oxlove 3: electric troogaloo"]
["N/A", "N/A", "2020/09/18", "#OxloveTheThird16459", "I'll just leave this here. Oxlove to everyone.", "Oxlove 3: electric troogaloo"]
["N/A", "N/A", "2020/09/17", "#OxloveTheThird16433", "Oxlove to antidepressants. I know they're not for everyone, but they have made my life so much better. I feel like myself again!", "Oxlove 3: electric troogaloo"]
["N/A", "N/A", "2020/09/17", "#OxloveTheThird16421", "Oxlove to anyone struggling with feeling like themselves right now. It\u2019s so understandable if you feel like you don\u2019t want to be at home anymore, but are also anxious about going back to uni at a time like this, whatever the reason - just remember you\u2019re amazing and even if you don\u2019t feel like you do, you absolutely have the strength and power inside you to get through this xx", "Oxlove 3: electric troogaloo"]
["N/A", "N/A", "2020/09/17", "#OxloveTheThird16419", "I feel so inadequate. Physically mentally socially - I feel like every aspect of my self esteem has taken a huge knock and my over thinking just grinds this further into the ground. Seriously considering not coming back to ox. Even tho it would kill me to not see my friends again ", "Oxlove 3: electric troogaloo"]
["N/A", "N/A", "2020/09/16", "#OxloveTheThird16374", "Oxlove to the English government. Totally acing it. I usually only manage to get my essay in 5 minutes before the deadline.", "Oxlove 3: electric troogaloo"]
["N/A", "N/A", "2020/09/16", "#OxloveTheThird16369", "why does anyone use this anymore its so unhealthy", "Oxlove 3: electric troogaloo"]
["N/A", "N/A", "2020/09/14", "#OxloveTheThird16350", "any recommendations for good (clean!) places to get a nose piercing in Oxford??", "Oxlove 3: electric troogaloo"]
["N/A", "N/A", "2020/09/14", "#OxloveTheThird16339", "[ASMR] Erotically mansplaining the vagina.You're amazing", "Oxlove 3: electric troogaloo"]
["N/A", "N/A", "2020/09/14", "#OxloveTheThird16334", "Cannot stop comparing myself to my boyfriend\u2019s ex. She is blonde petite and sexually exciting (from the few stories I have heard from my boyfriend) and I am exactly the opposite. Even though I\u2019m average sized, I am the biggest girl he has dated, not blonde, not that exciting in bed (I\u2019m fairly inexperienced). They were together for half a decade and all his friends shipped them and even now talk about stories of them when they were together. I cannot stop\u2026 See more", "Oxlove 3: electric troogaloo"]
["N/A", "N/A", "2020/09/14", "#OxloveTheThird16323", "Oxlove to the careers service for providing more useful information about this term than my college", "Oxlove 3: electric troogaloo"]
["N/A", "N/A", "2020/09/12", "#OxloveTheThird16313", "We all have that one friend ...", "Oxlove 3: electric troogaloo"]
["N/A", "N/A", "2020/09/12", "#OxloveTheThird16300", "Why do people go to the club? I really want to hear honest answers Personally it brang out the worst in me during freshers and first year. It's implausible that you are going to meet people because the music is too loud and most people are too pissed to recall the encounter or have coherent discussion. I don't know if I buy the \"going to have fun with my girls\" charade because through my experience, guys always end up involved (sorry if I'm being awfull\u2026 See more", "Oxlove 3: electric troogaloo"]
["N/A", "N/A", "2020/09/12", "#OxloveTheThird16289", "How am I supposed to make friends as a fresher? I would already stressed about this in a normal situation but now with corona it seems impossible (especially since other people seem to already be talking a lot in group chats whilst  I really struggle to have meaningful interactions through messages and hate video calls with a passion especially if I don't know the people) and I'm slightly dreading coming here as I'll know no one and probably just be lonel\u2026 See more", "Oxlove 3: electric troogaloo"]
["N/A", "N/A", "2020/09/11", "#OxloveTheThird16273", "The Moana soundtrack is so moving", "Oxlove 3: electric troogaloo"]
["N/A", "N/A", "2020/09/10", "#OxloveTheThird16258", "Oxlove to js @ j for being an amazing person", "Oxlove 3: electric troogaloo"]
["N/A", "N/A", "2020/09/10", "#OxloveTheThird16210", "But when the world needed her most, she vanished  Oxhate to the devil, I swear everything went downhill after this queen exposed the truth, monster can lady we need you ", "Oxlove 3: electric troogaloo"]
["N/A", "N/A", "2020/09/10", "#OxloveTheThird16208", "Oxlove to the physics department for their clear and helpful communication xxx", "Oxlove 3: electric troogaloo"]
["N/A", "N/A", "2020/09/9", "#OxloveTheThird16185", "Dont know who it is but a guy in the radcam with a green top and blue patterned face mask just made my day. First time back in the library since covid and im in love", "Oxlove 3: electric troogaloo"]
["N/A", "N/A", "2020/09/9", "#OxloveTheThird16181", "Oxlove to the Russian letter \u042b", "Oxlove 3: electric troogaloo"]
["N/A", "N/A", "2020/09/8", "#OxloveTheThird16138", "While Oxfess is down - Hi! Confused bi over here: I'm (F) romantically and sexually attracted to girls as well as guys, but I don't think of non-penetrative/heterosexual sex as fulfilling. I've been asked so many times if I'm 'just questioning' which has left me so unsure and confused, and I don't really know what to do about it because this has made me even more unsure. Can I be bi and still prefer heteronormative sex? \u2026 See more", "Oxlove 3: electric troogaloo"]
["N/A", "N/A", "2020/09/8", "#OxloveTheThird16125", "Oxlove to anyone experiencing impostor syndrome. Here an alternative is proposed:", "Oxlove 3: electric troogaloo"]
["N/A", "N/A", "2020/09/8", "#OxloveTheThird16107", "jeEEez you\u2019re hot", "Oxlove 3: electric troogaloo"]
["N/A", "N/A", "2020/09/8", "#OxloveTheThird16105", "would you collect rocks with me", "Oxlove 3: electric troogaloo"]
["N/A", "N/A", "2020/09/7", "#OxloveTheThird16098", "#OxloveTheThird16018", "Oxlove 3: electric troogaloo"]
["N/A", "N/A", "2020/09/6", "#OxloveTheThird16062", "Huge Oxlove and thanks to the two (Sommerville?) boys who walked me back to find my friends after Rum and Realpolitik in Michaelmas. I really appreciated it, and thank you for managing to keep somewhat straight faces when I asked you if you were planning to murder me. (I know this is a long time after the fact, but I can't remember if slightly drunk, slightly scared and very lost me remembered to thank you)", "Oxlove 3: electric troogaloo"]
["N/A", "N/A", "2020/09/6", "#OxloveTheThird16061", "#OxloveTheThird16018", "Oxlove 3: electric troogaloo"]
["N/A", "N/A", "2020/09/6", "#OxloveTheThird16044", "!!!", "Oxlove 3: electric troogaloo"]
["N/A", "N/A", "2020/09/6", "#OxloveTheThird16038", "Oxlove to my neuro atypical people out there. It can be hard and lonely sometimes especially when people we care about don't seem to be able to understand us, but we will get through it together .", "Oxlove 3: electric troogaloo"]
["N/A", "N/A", "2020/09/5", "#OxloveTheThird16011", "Oxlove to the ice rink- we took you for granted for so long but truth be told we need you in our lives xxx", "Oxlove 3: electric troogaloo"]
["N/A", "N/A", "2020/09/5", "#OxloveTheThird15976", "Freshers @ H please please please reach out to your college parents because we can\u2019t wait to talk to you! ", "Oxlove 3: electric troogaloo"]
["N/A", "N/A", "2020/09/3", "#OxloveTheThird15958", "Suck a butt tabsAnd not a nice juicy one either \u2026 See more", "Oxlove 3: electric troogaloo"]
["N/A", "N/A", "2020/09/3", "#OxloveTheThird15945", "Big love to all my fellow bi\u2019s!!!", "Oxlove 3: electric troogaloo"]
["N/A", "N/A", "2020/09/1", "#OxloveTheThird15912", "@admin comment: cw mental health issues. Mental health links are available in the pinned post...\u2026 See more", "Oxlove 3: electric troogaloo"]
["N/A", "N/A", "2020/09/1", "#OxloveTheThird15906", "Oxlove to those who keep talking about next term. I\u2019m sorry, but I really don\u2019t think it\u2019s going to happen. And I\u2019m just as upset about that thought as you are:(", "Oxlove 3: electric troogaloo"]
["N/A", "N/A", "2020/08/31", "#OxloveTheThird15885", "When I see another access initiative...", "Oxlove 3: electric troogaloo"]
["N/A", "N/A", "2020/08/31", "#OxloveTheThird15878", "Oxhate to my brain for completely losing the ability to focus. I have exams when I get back to revise for but I can barely focus for more than 10 minutes without getting distracted. I was really relying on having the college library to work in when I get back because that kind of environment really helps me focus, but now I'm slightly panicking because it's gonna be closed and I'm gonna be forced to work in my room most of the time.", "Oxlove 3: electric troogaloo"]
["N/A", "N/A", "2020/08/30", "#OxloveTheThird15872", "When you've been in Oxford for a grand total of sixteen (16) weeks and you've already been given college kids", "Oxlove 3: electric troogaloo"]
["N/A", "N/A", "2020/08/30", "#OxloveTheThird15858", "Oxhate to not waiving the residency requirement https://cherwell.org/.../oxford-may-face-local-control.../", "Oxlove 3: electric troogaloo"]
["N/A", "N/A", "2020/08/30", "#OxloveTheThird15846", "Oxlove to HathiTrust Digital Library, you're a god-send and so much better than sex xx", "Oxlove 3: electric troogaloo"]
["N/A", "N/A", "2020/08/28", "#OxloveTheThird15806", "The medic boys at SPC", "Oxlove 3: electric troogaloo"]
["N/A", "N/A", "2020/08/28", "#OxloveTheThird15789", "Mhairi Black I really do want to be your lover xxx(In a serious way like please marry me and lets move to a cottage near a loch)", "Oxlove 3: electric troogaloo"]
["N/A", "N/A", "2020/08/28", "#OxloveTheThird15786", "My tutors cancelling meetings with me", "Oxlove 3: electric troogaloo"]
["MF", "M", "2020/08/24", "#OxloveTheThird15684", "MF @ M, you need to know being crazy for you has got me through lockdown ", "Oxlove 3: electric troogaloo"]
["N/A", "N/A", "2020/08/22", "#OxloveTheThird15667", "a huge oxlove and haps baps to all things BFR", "Oxlove 3: electric troogaloo"]
["N/A", "N/A", "2020/08/20", "#OxloveTheThird15643", "massive oxlove to bg@k she works so hard everyday to make the most amazing access content for @kebleatlarge w/o the recognition she deserves  ur incredible and everyone at keble is forever so proud of and lucky to have u xx", "Oxlove 3: electric troogaloo"]
["N/A", "N/A", "2020/08/20", "#OxloveTheThird15630", "Yorkshire women are something else honestly", "Oxlove 3: electric troogaloo"]
["N/A", "N/A", "2020/08/18", "#OxloveTheThird15595", "Oxlove to all the Access Reps doing the most in such an intense time. You guys are trying your hardest and it\u2019s so reassuring to know there are people like you in the Oxford community ", "Oxlove 3: electric troogaloo"]
["JB", "SPC", "2020/08/18", "#OxloveTheThird15588", "JB@SPC big respect for letting in all state school offer holders", "Oxlove 3: electric troogaloo"]
["HS", "OY", "2020/08/17", "#OxloveTheThird15563", "HS@OYou are one of the most thoughtful people I have ever met. You go out of your way so often to do things for people to cheer them up. (And often those things come in packets of the most adorable crocheted animals!)You're an absolutely wonderful person, and we really appreciate you.", "Oxlove 3: electric troogaloo"]
["N/A", "N/A", "2020/08/13", "#OxloveTheThird15470", "Me trying to unobtrusively work out who\u2019s writing me Oxloves x", "Oxlove 3: electric troogaloo"]
["N/A", "N/A", "2020/08/12", "#OxloveTheThird15450", "Oxlove to the Queen's scaffolding FINALLY coming down", "Oxlove 3: electric troogaloo"]
["N/A", "N/A", "2020/08/11", "#OxloveTheThird15436", "what's the best way for a gay guy to meet other guys in lockdown, preferably oxford ones? don't think there are any more match-ups going on rn", "Oxlove 3: electric troogaloo"]
["N/A", "N/A", "2020/08/7", "#OxloveTheThird15375", "#oxlovethethird15347", "Oxlove 3: electric troogaloo"]
["N/A", "N/A", "2020/08/7", "#OxloveTheThird15372", "TW: Body dismorphia---\u2026 See more", "Oxlove 3: electric troogaloo"]
["N/A", "N/A", "2020/08/7", "#OxloveTheThird15371", "Big boy in nightclubs small boy in bed", "Oxlove 3: electric troogaloo"]
["N/A", "N/A", "2020/08/6", "#OxloveTheThird15360", "Are you really just going to not bother talking to me for over 4 months and expect I'll be close friends with you come October? Because I won't, I don't trust you at all, so by abandoning me you've ruined things for yourself", "Oxlove 3: electric troogaloo"]
["JD", "SPC", "2020/08/6", "#OxloveTheThird15355", "Oxlove to JD @ SPC", "Oxlove 3: electric troogaloo"]
["N/A", "N/A", "2020/08/6", "#OxloveTheThird15354", "Thoughts on a repaint?", "Oxlove 3: electric troogaloo"]
["N/A", "N/A", "2020/08/5", "#OxloveTheThird15345", "I wanna get back with my ex, muthafuckasBut I\u2019m not toxic so imma let them come to me", "Oxlove 3: electric troogaloo"]
["N/A", "N/A", "2020/08/3", "#OxloveTheThird15327", "Is a peng college kid really too much to ask for?", "Oxlove 3: electric troogaloo"]
["N/A", "N/A", "2020/08/3", "#OxloveTheThird15321", "The definitive Avatar:TLA characters tierlist", "Oxlove 3: electric troogaloo"]
["N/A", "N/A", "2020/08/3", "#OxloveTheThird15304", "#OxloveTheThird15287I feel you so so much. I honestly thought I was a lost cause because I find the idea of flirting with someone I\u2019m attracted to irl *terrifying*. what helped (and ultimately worked somehow what the hell??) is texting/tinder. honestly. the pressure of having to come up with something witty in one second is (mostly) gone. with the latter you know from the get go that both of you are potentially into each other. you also don\u2019t know the pe\u2026 See more", "Oxlove 3: electric troogaloo"]
["JH", "J", "2020/08/2", "#OxloveTheThird15285", "JH@J - are you single?", "Oxlove 3: electric troogaloo"]
["N/A", "N/A", "2020/08/2", "#OxloveTheThird15280", "I miss you. And it feels pathetic because of how very little time we spent together, but you made me feel human. I hope I can see you again one day ", "Oxlove 3: electric troogaloo"]
["N/A", "N/A", "2020/08/2", "#OxloveTheThird15269", "Oxlove to all Oxford couples!! Michaelmas is sooner than you think, stay strong! Everything will be so clear soon you\u2019ve got this", "Oxlove 3: electric troogaloo"]
["N/A", "N/A", "2020/08/2", "#OxloveTheThird15263", "I've got the obsession of watching YouTube videos about different subreddits, during lock down. Today's entry comes from the video R/Neckbeardthings Top Post of All time #77.Pent ting ginger astrologist, there's a gentle sir with chicken tendies waiting for you ", "Oxlove 3: electric troogaloo"]
["N/A", "N/A", "2020/08/1", "#OxloveTheThird15249", "Oxlove to Game of Thrones and its writer who manages the bare minimum of not being a TERF xx", "Oxlove 3: electric troogaloo"]
["N/A", "N/A", "2020/07/31", "#OxloveTheThird15241", "oxlove to hp (oxhate to jk rowling tho)", "Oxlove 3: electric troogaloo"]
["N/A", "N/A", "2020/07/29", "#OxloveTheThird15218", "What are the least talked about red flags in a relationship?", "Oxlove 3: electric troogaloo"]
["N/A", "N/A", "2020/07/27", "#OxloveTheThird15160", "Spencer ReidThat is all", "Oxlove 3: electric troogaloo"]
["N/A", "N/A", "2020/07/25", "#OxloveTheThird15098", "LL @spc, you are a true legend", "Oxlove 3: electric troogaloo"]
["N/A", "N/A", "2020/07/24", "#OxloveTheThird15067", "I didn't think I'd miss you, but I'd take your random daily messages over silence any time", "Oxlove 3: electric troogaloo"]
["N/A", "N/A", "2020/07/22", "#OxloveTheThird15017", "#OxloveTheThird15003", "Oxlove 3: electric troogaloo"]
["N/A", "N/A", "2020/07/22", "#OxloveTheThird15015", "Everything seems so backwards now", "Oxlove 3: electric troogaloo"]
["N/A", "N/A", "2020/07/22", "#OxloveTheThird15014", "#OxloveTheThird15008", "Oxlove 3: electric troogaloo"]
["N/A", "N/A", "2020/07/22", "#OxloveTheThird15012", "#oxlovethethird15000", "Oxlove 3: electric troogaloo"]
["N/A", "N/A", "2020/07/22", "#OxloveTheThird15011", "oh no", "Oxlove 3: electric troogaloo"]
["N/A", "N/A", "2020/07/22", "#OxloveTheThird15010", "It do be hard", "Oxlove 3: electric troogaloo"]
["N/A", "N/A", "2020/07/22", "#OxloveTheThird15008", "'Seb''Yes?''Sinalla'\u2026 See more", "Oxlove 3: electric troogaloo"]
["N/A", "N/A", "2020/07/22", "#OxloveTheThird15007", "M,", "Oxlove 3: electric troogaloo"]
["N/A", "N/A", "2020/07/22", "#OxloveTheThird15006", "Time.to.cuddle", "Oxlove 3: electric troogaloo"]
["N/A", "N/A", "2020/07/22", "#OxloveTheThird15005", "it be like that", "Oxlove 3: electric troogaloo"]
["N/A", "N/A", "2020/07/22", "#OxloveTheThird14993", "Oxmiss to the Gloucester Green Market gyoza", "Oxlove 3: electric troogaloo"]
["N/A", "N/A", "2020/06/27", "#OxloveTheThird14175", "I am OBSESSED", "Oxlove 3: electric troogaloo"]
["N/A", "N/A", "2020/06/27", "#OxloveTheThird14168", "I\u2019m a bi guy and definitely worry about not having sex with men as well as I do with women. I\u2019m definitely attracted to men as much as, if not more than I am to women but I want to wait until I\u2019m in a committed relationship with a man so it\u2019s more acceptable to take things slow... is this normal? I feel like there\u2019s such a strong hookup culture here and I worry I\u2019ll never explore that side of my sexuality unless I\u2019m willing to have sex right away", "Oxlove 3: electric troogaloo"]
["N/A", "N/A", "2020/06/26", "#OxloveTheThird14135", "Biggest Oxhate to LiVARpool, biggest cheaters/divers/hypocrites of the game", "Oxlove 3: electric troogaloo"]
["N/A", "N/A", "2020/06/26", "#OxloveTheThird14107", "YNWA", "Oxlove 3: electric troogaloo"]
["N/A", "N/A", "2020/06/26", "#OxloveTheThird14099", "I miss complaining about how much I despise England\u2019s weather", "Oxlove 3: electric troogaloo"]
["N/A", "N/A", "2020/06/25", "#OxloveTheThird14089", "Michael Cimino from Love, Victor is a teenage dream.PS. I still like to think of myself as a teenager", "Oxlove 3: electric troogaloo"]
["N/A", "N/A", "2020/06/25", "#OxloveTheThird14073", "Petition to change the portrait of Elizabeth I in Jesus college hall to a giant painting of JV!", "Oxlove 3: electric troogaloo"]
["N/A", "N/A", "2020/06/24", "#OxloveTheThird14023", "FUCK HOMOPHOBIA OF ANY KIND. Being gay is not a \u201csin\u201d  bimbo  if you\u2019re dealing with internalised homophobia or hate from your family just know that you\u2019re sexuality is valid and is perfectly okay. Whoever tells you that it\u2019s not has been brainwashed.", "Oxlove 3: electric troogaloo"]
["N/A", "N/A", "2020/06/23", "#OxloveTheThird13987", "Slideee into my dm\u2019s MC...???", "Oxlove 3: electric troogaloo"]
["N/A", "N/A", "2020/06/22", "#OxloveTheThird13958", "JD @ spc?? did you mean JaDe at spc <33", "Oxlove 3: electric troogaloo"]
["N/A", "N/A", "2020/06/22", "#OxloveTheThird13947", "Oxlove to this legend", "Oxlove 3: electric troogaloo"]
["N/A", "N/A", "2020/06/21", "#OxloveTheThird13880", "#OxloveTheThird13868This was exactly my experience for years. While I experienced pleasure, I thought of intense orgasms as something that just \u2018didn\u2019t happen for me.\u2019 However, at the beginning of lockdown I bought a cheap vibrator, and honestly it was the ultimate game changer. I was easily able to achieve what I\u2019d always thought impossible for me, and realised I was \u2018normal\u2019 after all. To all the women on here saying that they don\u2019t find masturbation a\u2026 See more", "Oxlove 3: electric troogaloo"]
["N/A", "N/A", "2020/06/21", "#OxloveTheThird13860", "Oxlove to whoever's reading this right now. You're doing great ", "Oxlove 3: electric troogaloo"]
["N/A", "N/A", "2020/06/21", "#OxloveTheThird13856", "Genuine question, what are the common ways to express clear romantic interest in someone (clear, no hint dropping or sorts please), without being predatory or creepy? Help a guy out please  don't remember being taught this back in school....", "Oxlove 3: electric troogaloo"]
["N/A", "N/A", "2020/06/20", "#OxloveTheThird13831", "Hitting submit on that final exam be like", "Oxlove 3: electric troogaloo"]
["N/A", "N/A", "2020/06/20", "#OxloveTheThird13795", "Oxlove to the outgoing fem soc committee! U guys r the loveliest bunch of people and did such a great job this year", "Oxlove 3: electric troogaloo"]
["N/A", "N/A", "2020/06/19", "#OxloveTheThird13771", "I don\u2019t want no twink.Where the power bottoms at?", "Oxlove 3: electric troogaloo"]
["N/A", "N/A", "2020/06/19", "#OxloveTheThird13747", "#OxloveTheThird13663 I love my friends to bits. I love knowing that they're thinking of me and I love that they invite me to zoom calls and things. But I hate that I'm not in the headspace to go to them. Yeah, I already feel like a bad friend for flaking, but your little comment didn't help. Things at home right now are really, really shit - like my closest family member is dying level shit - and sometimes sitting in a group zoom call pretending to be oka\u2026 See more", "Oxlove 3: electric troogaloo"]
["N/A", "N/A", "2020/06/19", "#OxloveTheThird13739", "Oxlove to my DateTonight Cafe match, I completely forgot", "Oxlove 3: electric troogaloo"]
["N/A", "N/A", "2020/06/19", "#OxloveTheThird13712", "when is student finance due", "Oxlove 3: electric troogaloo"]
["N/A", "N/A", "2020/06/18", "#OxloveTheThird13698", "Should I just give up and marry my best friend?", "Oxlove 3: electric troogaloo"]
["N/A", "N/A", "2020/06/18", "#OxloveTheThird13691", "Oxlove to Hassan from Hassan\u2019s dude Oxford won\u2019t be the same without you...", "Oxlove 3: electric troogaloo"]
["N/A", "N/A", "2020/06/18", "#OxloveTheThird13677", "To everyone who has relationship struggles, I found this helpful for identifying dissatisfactions and red flags.", "Oxlove 3: electric troogaloo"]
["MET", "SJC", "2020/06/18", "#OxloveTheThird13674", "MET @ SJC you\u2019re absolutely amazing :))", "Oxlove 3: electric troogaloo"]
["N/A", "N/A", "2020/06/18", "#OxloveTheThird13669", "I really like it when you kiss my head and I wish you did it more", "Oxlove 3: electric troogaloo"]
["N/A", "N/A", "2020/06/17", "#OxloveTheThird13650", "The moment of truth has arrived lads... To get rid of digestives For bourbons\u2026 See more", "Oxlove 3: electric troogaloo"]
["N/A", "N/A", "2020/06/17", "#OxloveTheThird13642", "I don\u2019t believe in love", "Oxlove 3: electric troogaloo"]
["MS", "SJC", "2020/06/17", "#OxloveTheThird13613", "MS @ SJC You are the OG ally", "Oxlove 3: electric troogaloo"]
["AS", "B", "2020/06/17", "#OxloveTheThird13612", "Oxlove to AS@B for being an amazing tute partner!! Here\u2019s to many more abrupt PowerPoint transitions", "Oxlove 3: electric troogaloo"]
["N/A", "N/A", "2020/06/17", "#OxloveTheThird13610", "Huge oxlove to JM, our RO, you're getting a lot of shit but are really doing an amazing job in awful circumstances.", "Oxlove 3: electric troogaloo"]
